announcement_title,announcement_url,pub_time,province,city,project_name,requirement_brief,requirement_desc,deadline,company_name,purchasing_unit_contact_number,contact_name,contact_phone,location_text,budget
城市轨道交通列车司机职业技能鉴定站智慧考试中心建设项目招标公告,http://www.ccgp.gov.cn/cggg/dfgg/gkzb/202602/t20260227_26200223.htm,2026-02-27T16:31+08:00,辽宁,,城市轨道交通列车司机职业技能鉴定站智慧考试中心建设项目,辽宁轨道交通职业学院拟建设城市轨道交通列车司机职业技能鉴定站智慧考试中心，预算330万元，需集成多种智能化设备和系统，以实现轨道交通司机技能鉴定的智能化管理和考核。,该项目旨在构建一个集智能化、自动化于一体的城市轨道交通列车司机职业技能鉴定站智慧考试中心。项目预算为330万元，要求供应商提供包括出退勤设备、电子排队叫号系统、视频监控与监考系统、综合信息显示系统、城轨司机技能鉴定半包围舱体、城轨司机技能鉴定驾驶操纵台等在内的一系列智能化设备和系统。这些设备和系统需满足特定的技术参数和功能要求，如人脸识别、指纹识别、酒精测试、视频监控、数据采集等，以实现对轨道交通司机技能鉴定的高效、精准管理。项目要求供应商在合同签订后30日内完成供货及安装，并需遵循政府采购相关法规和政策。,2026-03-20 09:30,辽宁轨道交通职业学院,刘老师024-62454773,王海欧、杨泉瑞、蒲吉,024-23883380-8017,沈阳经济技术开发区十三号路17甲5号,330.00万元
中国地质大学（武汉）智算服务器(一包）公开招标公告,http://www.ccgp.gov.cn/cggg/zygg/gkzb/202602/t20260226_26197408.htm,2026-02-26T21:55+08:00,湖北,武汉市,智算服务器(一包）,中国地质大学（武汉）需采购智算服务器1台，预算260万元，要求处理器、AI处理器、内存、硬盘、网卡等具体配置，不接受进口产品。,中国地质大学（武汉）智算服务器(一包）项目预算为260万元，不接受进口产品。采购需求包括推理节点1台，处理器≥4颗，单CPU物理核≥80核，主频≥2.9GHz；AI处理器≥8颗，单AI处理器规格≥560TFlops@FP16，128GB HBM；DDR5内存≥2TB；硬盘≥2块480GB SSD硬盘，≥4块3.84TB NVME SSD硬盘；网卡≥56个400GE网口，≥2个25GE网口，≥2个100GE网口，含光模块。合同履行期限为合同签订后1个月内完成供货，3个月内完成安装调试。不接受联合体投标。投标人需满足《政府采购法》第二十二条规定，提供《中小企业声明函》等资格要求，且未被列入失信被执行人等名单。,2026-03-19 09:30,中国地质大学（武汉）,李老师/027-67886243；技术联系人：陈老师/027-67885173,周泉、马振伟、张晓林、张翠粉,027-87820228,武汉市洪山区鲁磨路388号,260.00万元
大数据平台及质量追溯系统项目招标公告,http://www.ccgp.gov.cn/cggg/dfgg/gkzb/202602/t20260226_26196646.htm,2026-02-26T17:30+08:00,辽宁,开原市,大数据平台及质量追溯系统项目,开原市农业农村局招标建设大数据平台及质量追溯系统，预算600万元，旨在实现玉米业数据采集、治理、分析与应用，提升玉米质量安全和消费者信任。,本项目旨在建设一个大数据平台及质量追溯系统，预算为600万元，由开原市农业农村局负责。项目包括两个主要建设内容：1. 产业园大数据平台，基于农业农村部大数据平台打造农业大数据平台基座，实现玉米业数据的采集、治理、分析与应用，运用AI算法对玉米种植基地的生产数据、气象数据、病虫害数据进行深度分析，生成精准种植方案、灾害预警及农事操作建议，为管理者和农户提供科学决策依据。与省乡村振兴数字化综合服务平台进行数据对接，实现数据互联互通、共享交换。2. 玉米农产品质量追溯系统，以保障玉米质量安全、提升消费者信任为核心目标，依托物联网、大数据、二维码等前沿信息技术构建的玉米生产全链条信息化管理体系。从玉米的种子选育、种植管理、施肥用药、灌溉采收，到仓储运输、加工包装、流通销售等各个环节，通过传感器、二维码标签等设备实时采集数据，将玉米生长环境参数、农事操作记录、投入品使用详情、质检报告等关键信息进行整合与加密存储，形成唯一对应的数字化身份档案。合同履行期限为合同签订后12个月内完成。,2026-03-24 10:00,开原市农业农村局（开原市农业综合行政执法队、开原市乡村振兴局）,024-73338655,申德众,18004105590,开原市新城街冀州路61号,600.00万元
2026年新吴区旺庄站点空气质量保障服务项目采购公告,http://www.ccgp.gov.cn/cggg/dfgg/gkzb/202602/t20260226_26195898.htm,2026-02-26T16:28+08:00,,,2026年新吴区旺庄站点空气质量保障服务项目,2026年新吴区旺庄站点空气质量保障服务项目，预算512.5万元，分两个标段，一标段包括驻场服务、大数据AI智能升级指挥服务、非现场监管技术支撑服务；二标段包括科学源解析技术保障服务，合同期限一年。,2026年新吴区旺庄站点空气质量保障服务项目旨在提升旺庄站点的空气质量，预算为512.5万元人民币，分为两个标段。一标段的主要内容包括驻场服务、大数据AI智能升级指挥服务以及非现场监管技术支撑服务；二标段的主要内容包括科学源解析技术保障服务。项目不接受联合体投标，合同履行期限为一年，具体起始时间根据合同约定。投标人需满足《中华人民共和国政府采购法》第二十二条规定，包括具有独立承担民事责任能力的营业执照、法定代表人授权委托书、近一年财务状况报告等。此外，投标人还应满足特定资格要求，如为中国大陆境内合法注册的独立企（事）业法人单位，未被列入失信被执行人名单等。,2026-03-20 13:30,无锡市新吴区人民政府旺庄街道办事处,13961823956,吴雨洁,0510-82796055,机场路55号,512.50万元
广西正海招标有限公司关于南宁市邕宁区城乡防控系统维护项目（项目编号：NNZC2026-G3-090008-ZHZB）公开招标公告,http://www.ccgp.gov.cn/cggg/dfgg/gkzb/202602/t20260226_26195806.htm,2026-02-26T16:17+08:00,广西,南宁市,南宁市邕宁区城乡防控系统维护项目,南宁市邕宁区城乡防控系统维护项目，预算600万元，涉及AI人像智能感知监控抓拍升级、前端卡口设备运维、系统平台运维和系统集成服务。,南宁市邕宁区城乡防控系统维护项目旨在升级和维护城乡防控系统，确保公共安全。项目预算为600万元，包含四项主要服务：特定点位AI人像智能感知监控抓拍升级服务、前端卡口设备运维服务、系统平台运维服务和系统集成服务。项目要求投标人满足《中华人民共和国政府采购法》第二十二条规定，并落实政府采购政策，包括促进中小企业发展、支持本国产品、强制采购节能产品等。项目不接受联合体投标，合同履约期限为项目竣工验收合格之日起24个月。,2026-03-19 09:30,南宁市公安局邕宁分局,0771-4728108,覃相健,0771-2865989,南宁市邕宁区银峰路3号,600.00万元
楚雄州公安局GPU服务器、存储设备采购项目公开招标公告,http://www.ccgp.gov.cn/cggg/dfgg/gkzb/202602/t20260226_26195096.htm,2026-02-26T15:00+08:00,云南,楚雄市,楚雄州公安局GPU服务器、存储设备采购项目,楚雄州公安局需采购GPU服务器、存储设备，预算149.5万元，包括AI推理服务器2台、图片分析服务器2台、智能比对卡8张、存储服务器1套。,楚雄州公安局GPU服务器、存储设备采购项目，预算金额为149.5万元人民币，最高限价同为149.5万元。项目需求具体包括采购AI推理服务器2台、图片分析服务器2台、智能比对卡8张以及存储服务器1套，详细技术规格参数与要求见招标文件第三章。合同履行期限为合同签订后30个日历天内完成交货。项目不接受联合体投标。投标者需满足《中华人民共和国政府采购法》第二十二条规定，并落实政府采购政策，包括对小型、微型企业产品价格给予10%的价格扣除，对本国产品报价给予20%的价格扣除。招标文件可在云南省政府采购电子交易平台线上获取，投标文件递交截止时间为2026年3月19日09:00，开标地点为楚雄市永安路696号1号开标厅。,2026-03-19 09:00,云南省楚雄彝族自治州公安局,0878-3142110,毛老师,0878-6168885,楚雄市茶花大道469号,149.50万元
广西众联工程项目管理有限公司关于青秀山智慧化提升项目（GXZC2026-G1-000247-GXZL）的招标公告,http://www.ccgp.gov.cn/cggg/dfgg/gkzb/202602/t20260226_26194567.htm,2026-02-26T12:11+08:00,广西,南宁市,青秀山智慧化提升项目,青秀山智慧化提升项目需求包括人形机器人、四足机器人和智能翻译机器人，预算400万元。,青秀山智慧化提升项目旨在通过采购先进的智能设备提升景区的智能化水平。项目预算为400万元，需求包括：3台人形机器人，具有不同自由度和负载能力；1台具有高自由度和智能交互功能的人形机器人；5台仿生四足机器人，具备高速度和负载能力；3台智能翻译机器人，支持多语种AI透明屏一体机。所有设备需满足详细的技术规格，并在合同签订后60天内完成安装交付。项目不接受联合体投标，且投标人需遵守政府采购政策，包括中小企业发展、本国产品标准、节能产品和网络安全等要求。,2026-03-19 09:30,广西壮族自治区文化和旅游厅,0771-5529050,姚茜、包鹏、戚程,0771-4308370,南宁市金湖路24号,400.00万元
包头稀土高新技术产业开发区社会事务局（教育局）稀土高新区初中升学考试体测设备采购项目招标公告,http://www.ccgp.gov.cn/cggg/dfgg/gkzb/202602/t20260226_26194160.htm,2026-02-26T10:30+08:00,内蒙古,,稀土高新区初中升学考试体测设备采购项目,包头稀土高新区教育局需采购初中升学考试体测设备，预算120万元，包括体育学科大数据平台、AI体育测训一体机等设备。,包头稀土高新技术产业开发区社会事务局（教育局）计划采购稀土高新区初中升学考试体测设备，预算金额为120万元人民币。采购内容包括体育学科大数据平台4套、室内AI体育测训一体机-旗舰版（含屏）4套、AI肺活量测试仪配件8套、AI坐位体前屈测试仪配件4套、AI身高体重测试仪配件4套、室外AI短跑测试屏4套、室外AI长跑测试屏4套、跑步检测拓展配件包4套、室外跑步配套立杆（跑道终点长杆）8套、室外AI体测屏-引体向上4台。所有设备需在签订合同后两个月内完成供货安装及调试。供应商需满足《中华人民共和国政府采购法》第二十二条规定的条件，包括具有独立承担民事责任的能力、良好的商业信誉和财务会计制度、履行合同所需的设备和专业技术能力等。,2026-03-19 09:20,包头稀土高新技术产业开发区社会事务局（教育局）,0472-5311012,徐婧,0472-6868389,包头稀土高新区滨河新区天健路与东七街交汇处,120.00万元
山东省市场监督管理局山东省食品安全“互联网+AI监管”平台建设项目(2)公开招标公告,http://www.ccgp.gov.cn/cggg/dfgg/gkzb/202602/t20260226_26193723.htm,2026-02-26T01:00+08:00,山东,,山东省食品安全“互联网+AI监管”平台建设项目,山东省市场监督管理局拟建设食品安全“互联网+AI监管”平台，预算256万元，旨在提升食品安全监管效率和智能化水平。,山东省市场监督管理局计划建设一个食品安全“互联网+AI监管”平台，该项目预算为256万元人民币。平台将利用互联网和人工智能技术，提高食品安全监管的效率和智能化水平，确保食品安全。项目不接受联合体投标，合同履行期限为平台建设完成后20日内交付软测报告。投标人需满足《中华人民共和国政府采购法》第二十二条规定，且供应商不得被列入失信被执行人等名单。招标文件可在齐鲁云采交易系统免费获取，投标文件需在2026年3月18日09:30前上传至系统。,2026-03-18 09:30,山东省市场监督管理局,空,谭光磊,0531-55699102,空,256.00万元
北方民族大学智慧校园全域数据管理和分析平台建设（二期）项目招标公告,http://www.ccgp.gov.cn/cggg/zygg/gkzb/202602/t20260225_26193160.htm,2026-02-25T19:02+08:00,宁夏,银川市,北方民族大学智慧校园全域数据管理和分析平台建设（二期）项目,北方民族大学智慧校园全域数据管理和分析平台建设（二期）项目，预算209.47万元，需提供数据安全治理、非结构化数据治理、持续化数据治理等服务。,北方民族大学智慧校园全域数据管理和分析平台建设（二期）项目，预算209.47万元。项目需求包括：1. 数据安全治理服务，涉及统一身份认证平台及身份治理，包括单点登录、认证管理、身份管理、审计、系统设置、自服务、应用网关等模块；2. 非结构化数据治理服务，包括AI应用开发平台底座、通用智能问答模块、智能问数模块、AI后台管理系统等模块，以及数据应用及指标体系建设，涵盖部门数据看板、院系数据画像、领导驾驶舱、师生画像、校园指标构建等模块；3. 持续化数据治理服务，包括融合门户及低代码平台，涉及信息与服务融合、个性化要求、消息中心、日程中心、搜索中心、办事中心、个人中心、效能监督、基于企业微信的移动校园、运营中心、数据看板、AI唤起功能、数据交互、表单设计、工作流设计、报表引擎、协同开发、AI能力、系统集成与扩展、平台管理、部署模式、服务与生态、流程及应用服务开发等模块。项目要求自合同签订之日起180日历日内完成合同要求的服务。,2026-03-20 09:00,北方民族大学,李老师，0951-2067819,刘宇翔,18295699935,银川市西夏区文昌北街204号,209.47万元
中考体育与健康考试技术服务招标公告,http://www.ccgp.gov.cn/cggg/dfgg/gkzb/202602/t20260225_26191656.htm,2026-02-25T15:31+08:00,辽宁,沈阳市,中考体育与健康考试技术服务,沈阳市招生考试委员会办公室招标中考体育与健康考试技术服务，预算217万元，要求提供系统软件平台、硬件设备、操作及保障人员，确保考试过程公开公平公正，成绩发布及时准确。,本项目旨在为沈阳市中考体育与健康考试提供全面的技术服务，包括系统软件平台、硬件设备以及操作和保障人员。服务需覆盖沈阳市约6.5万名考生，计划在全市13个考点进行，要求供应商提供持续运行的综合考务管理系统平台，包含编组、检录、测试、成绩发布等多个子系统模块，并确保数据安全和实时更新。供应商还需配备足够的设备和人员，提供全方位的技术咨询和技术服务，解决技术问题，并保证考试设备的同一品牌、型号和规格。此外，服务还包括考试设备及其运输与装拆、考试系统适应性开发与部署运维、考前培训服务等。项目预算为217万元，服务期限为3个年度，合同一年一签。,2026-03-18 09:00,沈阳市招生考试委员会办公室,67851627,庄来祥,024-22896697,沈阳市和平区北七马路37号,217.00万元
现代化生态环境监测智能分析子系统建设项目的公开招标公告,http://www.ccgp.gov.cn/cggg/dfgg/gkzb/202602/t20260226_26193817.htm,2026-02-26T09:10+08:00,上海,,现代化生态环境监测智能分析子系统建设项目,上海市环境监测中心拟建设现代化生态环境监测智能分析子系统，提升环境监测感知、数据驱动和智慧决策能力。,该项目旨在构建生态环境遥感监测、智能化站房管理、环境监测数据智能质控、环境监测分析智脑等9个核心模块，并部署6个智能分析大模型，以实现对多源环境数据的深度分析和价值挖掘。项目将通过数据+AI双轮驱动，加强遥感监测业务化应用，构建智能化站房管理闭环架构，强化多要素监测技术融合与业务覆盖，提升监测数据质量，增强监测数据分析应用水平，提高环境保护决策支撑能力，增强监测任务协同能力，以及提升数字化技术应用创新能力。项目建设期限为自合同签订之日起至2027年11月30日前完成，包括2个月试运行。,2026-03-18 10:00,上海市环境监测中心（上海长三角区域空气质量预测预报中心）,021-24011953,张姝雅,021-35968053,三江路55号,237.00万元
现代化生态环境监测智能分析子系统建设项目的公开招标公告,http://www.ccgp.gov.cn/cggg/dfgg/gkzb/202602/t20260226_26193816.htm,2026-02-26T09:10+08:00,上海,,现代化生态环境监测智能分析子系统建设项目,上海市环境监测中心拟建设现代化生态环境监测智能分析子系统，提升环境监测感知、数据驱动和智慧决策能力。,本项目旨在构建集生态环境遥感监测、智能化站房管理、环境监测数据智能质控、环境监测分析智脑等9个核心模块于一体的现代化生态环境监测智能分析子系统，开发部署环境监测智能分析大模型、空气质量预报大模型等6个智能分析大模型。项目将通过“数据+AI”双轮驱动，加强多源环境数据分析应用和价值挖掘，提升全域生态环境监测感知能力、数据驱动能力和智慧决策能力。项目建设内容包括环境监测能力提升、监测数据质量提升、监测数据分析应用水平提升、环境保护决策支撑能力提升、监测任务协同能力提升、数字化技术应用创新能力提升等六个方面。项目将自合同签订之日起至2027年11月30日前完成项目建设并通过验收，包括为期2个月的试运行。,2026-03-18 10:00,上海市环境监测中心（上海长三角区域空气质量预测预报中心）,021-24011953,张姝雅,021-35968053,三江路55号,237.00万元
鄂托克前旗政务服务中心鄂托克前旗全域视联态势感知项目招标公告,http://www.ccgp.gov.cn/cggg/dfgg/gkzb/202602/t20260225_26191509.htm,2026-02-25T15:12+08:00,内蒙古,鄂尔多斯市,鄂托克前旗全域视联态势感知项目,鄂托克前旗全域视联态势感知项目旨在通过采购视频监控设备、无人机、服务器、存储设备、交换设备、防火墙、VPN设备、应用软件等，实现全域视联态势感知，预算292万元。,鄂托克前旗政务服务中心的全域视联态势感知项目，预算为292.87万元，采用公开招标方式采购。项目需求包括视频监控设备（3km、5km、10km双光谱云台）、无人机和机场平台、各类服务器（视频应用、地图算力、文件、APP、数据库、智慧物联感知、视频云、大模型、数据存储节点、元数据、云存储系统管理、云存储容量授权）、移动存储设备（硬盘）、交换机、防火墙、VPN设备、应用软件（全域视联应用软件、算法仓调度、非法开垦、非法畜牧、违建施工、森林草原防火、垃圾倾倒、文物保护）等。此外，还包括基础环境集成实施服务、信息技术合作服务（专线接入服务、汇聚专线接入服务、无人机百兆专线接入服务、地理数据处理和数据服务、卫星图斑分析服务、短信服务）、其他运营服务（运营商高点资源租赁）、其他专业技术服务（人员服务）、软件集成实施服务（摄像机电力接入服务、无人机电力接入服务）等。项目不接受联合体投标，合同履行期限为合同签订后60日内交付，服务期为三年。,2026-03-19 09:30,鄂托克前旗政务服务中心,18547790099,宝音,13134868777,鄂尔多斯市鄂托克前旗,292.00万元
西岗区智慧化城区综合管理平台视频监控服务采购项目公开招标公告,http://www.ccgp.gov.cn/cggg/dfgg/gkzb/202602/t20260228_26203481.htm,2026-02-28T14:38+08:00,辽宁,大连市,西岗区智慧化城区综合管理平台视频监控服务采购项目,西岗区智慧化城区综合管理平台视频监控服务采购项目，预算225万元，需提供500个监控点位服务，合同期限一年，不接受联合体投标。,西岗区智慧化城区综合管理平台视频监控服务采购项目，预算225万元，最高限价225万元。项目需求为提供500个前端监控点位服务的通信运营商一家，服务内容包括视频监控服务等，合同履约期限自合同签定之日起一年。在采购人落实下一年度采购预算的前提下，且本项目服务内容及服务要求具有相对固定性、延续性，价格变化幅度小，双方协商同意，可依据本次采购结果所签订的合同最多续签两次，但合同应当一年一签。本项目不接受联合体投标。投标人须具有并提供中华人民共和国工业和信息化部颁发的《中华人民共和国基础电信业务经营许可证》的基础电信运营商或其分支机构。,2026-03-23 09:00,大连市西岗区大数据中心(大连市西岗区365政务服务中心),0411-83613320,刘工,0411-65851267,辽宁省大连市西岗区胜利东路333号,225.00万元
扬州市数据局扬州市政务信息系统改造项目（第一批）采购公告,http://www.ccgp.gov.cn/cggg/dfgg/gkzb/202602/t20260227_26201602.htm,2026-02-27T19:27+08:00,江苏,扬州市,扬州市数据局扬州市政务信息系统改造项目（第一批）,扬州市数据局政务信息系统改造项目（第一批）旨在对市委网络安全和信息化委员会办公室、发展和改革委员会、民政局、生态环境局和财政局等5个市级部门的7个政务信息系统进行改造，并对接相关公共支撑能力。,扬州市数据局扬州市政务信息系统改造项目（第一批）的采购需求包括对市委网络安全和信息化委员会办公室、发展和改革委员会、民政局、生态环境局和财政局等5个市级有关部门的7个政务信息系统完成改造，并按要求对接相关公共支撑能力。项目预算为284.75万元，最高限价合计为238.65万元，涉及扬州市网络综合治理平台迁移适配项目、扬州市重大项目全生命周期服务管理平台项目、扬州市公共信用大数据服务平台项目、扬州市智慧民政云平台迁移适配项目、扬州生态环境监测“一张网”管理系统、扬州市污染防治综合监管平台和扬州市财税库联网分析系统迁移适配改造项目。中标人需与采购人签订总合同，并与最终用户签订分签合同。项目不接受联合体投标，且面向中小企业采购。,2026-03-20 09:30,扬州市数据局本级,051482081776,张自美,0514-82087195,江苏省扬州市,284.75万元
贵州人社一体化平台建设项目公开招标公告,http://www.ccgp.gov.cn/cggg/dfgg/gkzb/202602/t20260226_26196303.htm,2026-02-26T16:59+08:00,贵州,贵阳市,贵州人社一体化平台建设项目,贵州人社一体化平台建设项目旨在建设统一经办服务平台、数据管理平台、技术支撑中台，制定一体化标准规范，提供深化设计、监理、等保测评、密码测评和软件测试服务。,贵州人社一体化平台建设项目需求包括：1. 建设统一经办服务平台，整合人社信息系统，支持跨领域业务协同；2. 建设统一数据管理平台，推进数据资源汇聚，开展数据治理，建设数据应用平台，实现数据共享管控；3. 建设一体化平台技术支撑中台，升级改造公共服务平台；4. 制定一体化标准规范，构建统一人社标准规范体系与管理平台；5. 提供深化设计服务，完成项目深化设计方案编制，配合需求分析和系统检查复核；6. 提供全过程监理服务，履行审批方案、签发项目开工令等职责；7. 开展系统等级保护测评，出具报告；8. 依据国家标准加强信息系统密码应用，提升安全防护水平；9. 提供软件测试服务，进行功能测试、性能测试等，验证系统是否达到项目要求。项目预算815.24万元，不接受联合体投标。,2026-03-19 09:30,贵州省人力资源和社会保障厅,0851-85837346,张奇飞、董松、陈艳琳,0851-84394525,贵阳市云岩区延安中路20号,815.24万元
