project_name,pub_time,ai_project_title,requirement_brief,requirement_desc,deadline,company_name,contact_name,contact_phone,province,city,budget,announcement_url
林州市住房和城乡建设局林州市高品质生活圈口袋公园配套项目设备采购项目,2026-03-04T16:24+08:00,林州市口袋公园AI智能运动设备采购,该项目旨在为林州市高品质生活圈口袋公园配套项目采购AI智能运动设备，提升公园智能化水平，增强市民运动体验。,"{'AI技术要求': '项目中提到了AI智能运动设备，但未给出具体的技术参数和性能要求。', 'AI功能要求': '项目中提到了AI智能运动设备，但没有具体说明其功能要求，需要投标人根据项目需求提供相应的AI智能运动设备。', 'AI业务场景': 'AI智能运动设备将应用于林州市高品质生活圈口袋公园配套项目中，可能用于提升公园的智能化水平，为市民提供更加便捷、智能的运动体验。', 'AI性能指标': '项目中未给出AI智能运动设备的具体性能指标要求。'}",2026年03月26日,林州市住房和城乡建设局,刘振宇,18272580591,河南,林州市,516.12万元,http://www.ccgp.gov.cn/cggg/dfgg/gkzb/202603/t20260304_26217736.htm
云南财经大学物流大数据平台垂直大模型项目25170（四次）,2026-03-04T16:15+08:00,云南财经大学物流大数据平台建设,该项目旨在构建物流大数据垂直大模型平台，集成智能问答、中老铁路物流分析及冷链监测系统，实现数据治理与知识库建设，支持教学科研实训。项目需在30日内完成交付，并提供至少12个月的免费技术支持与维护服务。,"{'技术要求': ['物流大数据垂直大模型平台系统建设', '智能问答系统', '中老铁路进出口物流分析系统', '冷链物流监测系统'], '功能要求': ['数据治理与知识库建设', '教学科研实训系统开发及课程集成'], '业务场景': ['中老铁路进出口物流分析', '冷链物流监测', '教学科研实训'], '性能指标': ['自合同签订之日起30日内完成项目交付', '提供项目验收后不少于十二个月的免费技术支持与维护服务']}",2026年03月25日,云南财经大学,旃逸飞、陈亚雄、赵锦娟、杨学芳,0871-65838555,云南,昆明市,39.00万元,http://www.ccgp.gov.cn/cggg/dfgg/gkzb/202603/t20260304_26217635.htm
南宁市武鸣区中医医院2025年第一批医疗设备采购项目-3D腹腔镜系统、高清腹腔镜系统（重）,2026-03-04T16:09+08:00,南宁市武鸣区中医医院3D腹腔镜系统采购,采购3D腹腔镜系统和高清腹腔镜系统，提升医院手术精准度。,本项目旨在采购3D腹腔镜系统和高清腹腔镜系统，以提高南宁市武鸣区中医医院的手术精准度和诊断能力。3D腹腔镜系统需具备4K图像处理性能，输出3840*2160超高清像素影像，支持16:9图像比例，逐行扫描，像素800万以上，能处理3D和2D画面信号。系统还需具备3D旋转功能，实现3D显示模式下旋转回正。高清腹腔镜系统也需具备4K图像处理性能，输出3840×2160超高清像素影像，支持光谱染色功能，便于区分异形血管，辅助临床诊断。两个系统均需在合同签订后30天内交货并验收完毕。,2026年03月26日,南宁市武鸣区中医医院,韩欣彤、罗灿明,0771-5640353,广西,南宁市,280.00万元,http://www.ccgp.gov.cn/cggg/dfgg/gkzb/202603/t20260304_26217518.htm
山西医科大学第一医院智慧消化专科质控信息平台项目,2026-03-04T16:08+08:00,智慧消化专科质控信息平台建设,该项目旨在构建一个智慧消化专科质控信息平台，集成现有系统功能并新增内镜检查科室质控模块，实现对医院消化内镜医疗行为的监管和质控指标的智能统计分析，满足智能内镜中心建设、质量控制、医师规培、绩效考核等需求。,"{'技术要求': '智慧消化专科质控信息平台需要涵盖现有系统的所有功能，并增加消化内镜检查科室质控模块。该平台应能监管医院医生的消化内镜医疗行为，并对内镜检查各项数据、质控指标进行准确、详细、智能、高效地统计和分析。', '功能要求': '平台需满足智能内镜中心建设、质量控制、医师规培、绩效考核、临床研究、医保报销等多种需求。', '性能要求': '平台应能够对数据进行智能统计和分析，以支持医院的医疗行为监管和质控指标管理。'}",2026年03月25日,山西医科大学第一医院,高婧、杨文举、辛广、唐文秀、雒阳,0351-8212172,山西,,190.00万元,http://www.ccgp.gov.cn/cggg/dfgg/gkzb/202603/t20260304_26217500.htm
永康五金技师学院实训培训智能化系统采购项目,2026-03-04T16:05+08:00,无相关要求,无相关要求,无相关要求,2026年03月24日,永康五金技师学院,王飞,18757917317,浙江,永康市,90.00万元,http://www.ccgp.gov.cn/cggg/dfgg/gkzb/202603/t20260304_26217462.htm
云南能源职业技术学院无人机行业应用综合实训室建设项目,2026-03-04T15:35+08:00,无相关要求,无相关要求,无相关要求,2026年03月26日,云南能源职业技术学院,王老师 蒋亚楠,0874-3985757 13887161837,云南,曲靖市,99.95万元,http://www.ccgp.gov.cn/cggg/dfgg/gkzb/202603/t20260304_26217015.htm
云南省妇幼保健院2025年新院建设第一批检验类设备采购项目（二次）,2026-03-04T15:05+08:00,无相关要求,无相关要求,无相关要求,2026年03月25日,云南省妇幼保健院,赵荣钢、杨佳、吴限、刘阳,0871-65381676,云南,昆明市,300.00万元,http://www.ccgp.gov.cn/cggg/dfgg/gkzb/202603/t20260304_26216604.htm
火化炉及配套设施采购项目,2026-03-04T14:58+08:00,包头市殡仪馆智能火化炉采购项目,该项目旨在采购包头市殡仪馆所需的智能拣灰火化机及其配套设施，通过引入人工智能技术，提升火化服务的智能化水平，提高火化效率和环保性能，预算204万元。,"根据提供的项目信息，该项目为包头市殡仪馆火化炉及配套设施采购项目，涉及的人工智能应用相关的核心信息如下：
1. 技术要求：项目中涉及的智能拣灰火化机，要求具备智能化功能，具体技术规格、参数及要求详见采购文件。
2. 功能要求：智能拣灰火化机作为殡仪设备，需要满足智能化拣灰处理的功能需求，提高火化效率和环保性能。
3. 性能要求：项目对智能拣灰火化机的具体性能指标未作明确说明，需参照采购文件中的详细要求。
4. 应用场景：智能拣灰火化机将应用于包头市殡仪馆的火化服务中，利用人工智能技术提升殡葬服务的智能化水平。
5. 项目预算：智能拣灰火化机的预算金额为204万元，占项目总预算的52.3%。
综上所述，该项目在殡葬服务领域引入人工智能技术，通过智能化火化设备提升服务效率和质量。但项目信息中对AI的具体技术细节和性能指标描述较为简略，需进一步查阅采购文件获取详细要求。",2026年03月25日,包头市殡仪馆,徐婧,0472-6868389,内蒙古,包头市,390.00万元,http://www.ccgp.gov.cn/cggg/dfgg/gkzb/202603/t20260304_26216524.htm
原阳县住房建设和城市管理局城市基础设施生命线建设项目,2026-03-04T14:42+08:00,无相关要求,无相关要求,无相关要求,2026年03月27日,原阳县住房建设和城市管理局,张威,16650335022,河南,,110.00万元,http://www.ccgp.gov.cn/cggg/dfgg/gkzb/202603/t20260304_26216414.htm
莲都区碧湖新城平原幼儿园拆改建工程（智能化工程设备采购）,2026-03-04T14:19+08:00,无相关要求,无相关要求,无相关要求,2026年03月24日,丽水市莲都区碧湖平原幼教集团平原幼儿园,王红雁,0578-2800214,浙江,,72.33万元,http://www.ccgp.gov.cn/cggg/dfgg/gkzb/202603/t20260304_26216279.htm
武汉工程大学大数据创新实践平台设备采购,2026-03-04T10:22+08:00,武汉工程大学大数据创新实践平台,建设包含机器学习与数据挖掘模块的大数据创新实践平台，支持人工智能教学和科研，预算865.2万元，30天内完成交货验收。,武汉工程大学大数据创新实践平台设备采购项目中涉及人工智能应用的核心信息如下：1. 采购需求包括机器学习与数据挖掘实验课程模块，这是与人工智能直接相关的模块。2. 机器学习与数据挖掘是人工智能领域的关键技术，涉及到算法模型训练、特征工程、结果评估等核心功能。3. 该项目要求供应商提供大数据创新实践平台相关设备，包括大数据可视化分析、实训支撑、考试管理等，这些设备和平台需要与机器学习数据挖掘模块相互配合，共同支撑人工智能教学和科研工作。4. 项目预算为865.2万元，合同履行期限为合同签订后30天内完成交货、调试并通过验收。5. 项目不接受联合体投标、合同分包和专门面向中小微企业的投标。综上所述，该项目聚焦于大数据创新实践平台建设，其中机器学习与数据挖掘模块是人工智能应用的核心组成部分，需要供应商提供相应的技术设备和解决方案，以满足高校人工智能教学和科研的需求。,2026年03月05日,武汉工程大学,徐清晨、夏雨珊、张盛华、吴坤、田佼玉,027-87296088,湖北,,86.52万元,http://www.ccgp.gov.cn/cggg/dfgg/gkzb/202603/t20260304_26215498.htm
河北省光谱数据库建设关键技术研究及应用示范等2个项目“应用软件”采购,2026-03-04T11:44+08:00,无相关要求,无相关要求,无相关要求,2026年03月26日,河北省第三测绘院,邸飞,0311-86046560,河北,石家庄市,94.00万元,http://www.ccgp.gov.cn/cggg/dfgg/gkzb/202603/t20260304_26215911.htm
禅城区电子政务基础支撑云资源服务（2026年） 项目,2026-03-04T17:07+08:00,禅城区电子政务云资源服务AI应用,构建禅城区电子政务云资源服务平台，提升政务处理效率和智能化水平,无相关要求,2026年03月25日,佛山市禅城区大数据应用服务中心,刘淳瑜,0757-82345019,广东,佛山市,114.00万元,http://www.ccgp.gov.cn/cggg/dfgg/gkzb/202603/t20260304_26218618.htm
大数据集成集群实训室设备采购,2026-03-04T15:12+08:00,大数据集成集群实训室设备采购,东莞职业技术学院采购大数据集成集群实训室设备，预算247.472万元。,本项目为东莞职业技术学院大数据集成集群实训室设备采购，预算金额247.472万元。主要采购内容包括大数据集成集群实训室设备1项，要求详见采购文件。项目不接受联合体投标，合同履行期限为自签订合同之日起90日内交货并安装完毕。投标人需满足《中华人民共和国政府采购法》第二十二条规定的条件，包括具有独立承担民事责任的能力、依法缴纳税收和社会保障资金的良好记录、良好的商业信誉和健全的财务会计制度、履行合同所必需的设备和专业技术能力、参加采购活动前3年内无重大违法记录等。本项目不属于专门面向中小企业采购的项目，标的所属行业为工业。投标人未被列入“信用中国”网站失信记录名单，不处于中国政府采购网禁止参加政府采购活动期间。项目采购的主要标的（核心产品）为“智慧交通数据服务平台”。,2026年03月25日,东莞职业技术学院,刘艳,0769-22457332,广东,东莞市,247.47万元,http://www.ccgp.gov.cn/cggg/dfgg/gkzb/202603/t20260304_26216649.htm
潍坊市公共视频资源统建服务项目,2026-03-04T01:00+08:00,无相关要求,无相关要求,无相关要求,2026年03月24日,潍坊市大数据局,丁艳艳,0536-8090287,山东,潍坊市,270.24万元,http://www.ccgp.gov.cn/cggg/dfgg/gkzb/202603/t20260304_26215177.htm
内蒙古白音敖包国家级自然保护区保护及监测设施建设一一动物疫源疫病监测和有害生物防治项目,2026-03-04T09:14+08:00,内蒙古白音敖包保护区AI监测与防治系统,本项目旨在通过引入红外线夜视仪和智能虫情监测系统等AI设备，提升内蒙古白音敖包国家级自然保护区动物疫源疫病监测和有害生物防治的智能化水平，实现自动化、精准化监测，保护生态环境。,"在内蒙古白音敖包国家级自然保护区保护及监测设施建设项目中，涉及人工智能应用的核心信息如下：1. 红外线夜视仪（红外线热成像仪）6台，预算330,000元。2. 智能虫情监测系统4台，预算220,000元。红外线夜视仪和智能虫情监测系统是项目中主要的AI相关设备。红外线夜视仪利用红外热成像技术，可在夜间或恶劣天气条件下进行动物监测。智能虫情监测系统则利用图像识别、数据分析等AI技术，实现对有害生物的自动识别、监测和预警。项目对这些AI设备的具体技术参数和性能要求详见采购文件。此外，项目还采购了大量农林牧渔仪器和实验室设备，如显微镜、酶标分析仪等，为AI监测设备提供数据采集、分析的配套支持。整体来看，项目通过引入AI监测设备，旨在提升自然保护区动物疫源疫病监测和有害生物防治的智能化水平，实现自动化、精准化监测。",2026年03月25日,赤峰市白音敖包自然保护区管理局,内蒙古和纳工程咨询有限公司,0476-5945985,内蒙古,,113.00万元,http://www.ccgp.gov.cn/cggg/dfgg/gkzb/202603/t20260304_26215267.htm
翔安区智慧交通建设（一期）项目,2026-03-04T19:15+08:00,无相关要求,无相关要求,无相关要求,2026年03月25日,中国共产党厦门市翔安区委员会政法委员会,张凤玲,0592-5131857、5131957,福建,厦门市,178.00万元,http://www.ccgp.gov.cn/cggg/dfgg/gkzb/202603/t20260304_26220289.htm
厦门市中小企业公共服务平台网络市级枢纽服务平台运维项目,2026-03-04T16:48+08:00,无相关要求,无相关要求,无相关要求,2026年03月25日,厦门市中小企业服务中心,张毅、杜亚娟,0592-2229278、2233020,福建,厦门市,520.00万元,http://www.ccgp.gov.cn/cggg/dfgg/gkzb/202603/t20260304_26218205.htm
兰州石化职业技术大学汽车工程应用及数字化智慧交通平台建设项目(二次),2026-03-04T16:40+08:00,无相关要求,无相关要求,无相关要求,2026年03月25日,兰州石化职业技术大学,郑丽娟,17693116166,甘肃,兰州市,704.99万元,http://www.ccgp.gov.cn/cggg/dfgg/gkzb/202603/t20260304_26218072.htm
公立医院高质量发展购置配套医疗设备项目（老年疾病诊疗护理能力提升项目）(五次),2026-03-04T16:11+08:00,老年疾病诊疗护理智慧防控系统建设,该项目旨在通过构建老年综合评估智慧防控系统，提升公立医院在老年疾病诊疗护理方面的服务质量和效率。系统将集成先进的AI技术，以实现对老年患者健康状况的精准评估和有效管理，从而增强医院对老年疾病的诊疗护理能力。,"{'AI_Related_Technology': '老年综合评估智慧防控系统', 'Function_Requirements': '老年综合评估智慧防控系统，用于老年疾病诊疗护理能力提升项目。', 'Performance_Requirements': '具体技术规格、参数及要求详见采购文件。', 'Business_Application_Scenarios': '老年疾病诊疗护理能力提升项目，涉及老年综合评估智慧防控系统的应用。'}",2026年03月25日,哈尔滨市第四医院,吴先生,15004670293,黑龙江,,231.53万元,http://www.ccgp.gov.cn/cggg/dfgg/gkzb/202603/t20260304_26217566.htm
孝昌县中医医院新院区建设项目智慧医疗系统,2026-03-04T16:08+08:00,孝昌县中医医院智慧医疗系统建设,建设智慧医疗系统，提升医疗服务效率和质量。,孝昌县中医医院新院区建设项目智慧医疗系统，主要涉及门诊医生工作站、门诊电子病历等内容。项目要求在12个月内完成需求分析、软件开发与硬件集成、部署实施、调试改造上线、试运行及验收工作，试运行期限不少于1个月。项目预算金额为709.6628万元。具体AI相关技术要求和功能需求未在公告和附件中明确提及。,2026年03月05日,孝昌县中医医院,文科、刘晋钰、汪树新,15623666381,湖北,,709.66万元,http://www.ccgp.gov.cn/cggg/dfgg/gkzb/202603/t20260304_26217513.htm
2026年东莞市委政法委信息系统运营、云资源租赁、通信维护、安全服务项目,2026-03-04T14:18+08:00,东莞市委政法委信息系统AI能力建设,构建东莞市委政法委信息系统，整合云资源、通信维护及安全服务，提升智能化水平。,本项目涉及东莞市委政法委信息系统运营、云资源租赁、通信维护、安全服务等方面，旨在通过智能化技术提升信息系统的运营效率和安全性。项目分为四个采购包：1) 信息系统运营服务，预算1663500元，要求供应商提供东莞市委政法委信息系统运营服务，包括智慧网格信息系统、块数据支撑系统和“雪亮工程”系统等，服务期限7-8个月；2) 云资源租赁服务，预算1205524元，要求提供“雪亮工程”行业云资源租赁服务，服务期限8个月；3) 通信维护服务，预算849600元，要求提供“雪亮工程”项目通信链路租赁服务，服务期限8个月；4) 安全服务，预算440000元，要求提供信息系统等级保护测评服务，服务期限至取得备案回执之日止。项目要求供应商具备良好的商业信誉、健全的财务会计制度、履行合同所必需的设备和专业技术能力，且近3年内无重大违法记录。,2026年03月25日,中共东莞市委政法委员会,叶工,0769-26998501,广东,东莞市,415.86万元,http://www.ccgp.gov.cn/cggg/dfgg/gkzb/202603/t20260304_26218533.htm
化学生物实验室设备采购项目,2026-03-04T14:05+08:00,化学生物实验室设备采购项目,该项目旨在采购化学生物实验室设备，提升教学实验条件。,无相关要求,2026年03月25日,五大连池风景名胜区自然保护区初级中学,黑龙江铄安工程项目管理有限公司,4009633037,黑龙江,,92.00万元,http://www.ccgp.gov.cn/cggg/dfgg/gkzb/202603/t20260304_26216241.htm
智能化工单元操作实训室,2026-03-04T11:55+08:00,智能化工实训室MES系统,云南能源职业技术学院旨在通过采购智慧生产管理系统（MES）实现化工单元操作实训室的智能化管理。该系统需集成AI技术，实现实时监控、数据分析、故障预测维护及生产调度优化，以提高实训效率和质量。,云南能源职业技术学院智能化工单元操作实训室项目中涉及人工智能应用的核心信息如下：1. 采购需求中包含智慧生产管理系统（MES）1套，这是该项目中与人工智能应用相关的核心内容。智慧生产管理系统（MES）是一套集成的信息化系统，通过应用人工智能、大数据等技术，实现对化工单元操作实训室的智能化管理。2. 智慧生产管理系统（MES）的主要功能要求包括：（1）实现对化工单元操作实训室的实时监控、数据采集和分析，通过机器学习等AI技术对生产过程进行优化和改进；（2）具备故障诊断和预测性维护功能，利用人工智能算法对设备状态进行实时监测，预测潜在故障并提前进行维护；（3）支持生产过程的智能调度和优化，通过AI技术对生产任务进行智能排程，提高生产效率和产品质量。3. 性能要求方面，智慧生产管理系统（MES）需要满足以下指标：（1）系统响应时间不超过2秒，保证实时监控和数据处理的时效性；（2）系统稳定性高，故障率不超过0.1%，确保长期稳定运行；（3）系统兼容性好，能够与现有的化工单元操作设备和信息化系统无缝对接。4. 该项目对智慧生产管理系统（MES）供应商的特定资格要求包括：（1）投标人不得为“信用中国”网站列入失信被执行人、税收违法黑名单的投标人；（2）投标人不得为中国政府采购网政府采购严重违法失信行为记录名单中被财政部门禁止参加政府采购活动的投标人。以上是该项目中与人工智能应用相关的核心信息，包括技术要求、功能要求和性能要求等。,2026年03月27日,云南能源职业技术学院,钱霞,13769702547,云南,曲靖市,103.00万元,http://www.ccgp.gov.cn/cggg/dfgg/gkzb/202603/t20260304_26215959.htm
随州市青春化工工业园智慧园区一体化平台运维项目,2026-03-04T11:36+08:00,无相关要求,无相关要求,无相关要求,2026年03月26日,随州高新技术产业开发区管委会机关本级,孟玮,07223323282,湖北,随州市,250.00万元,http://www.ccgp.gov.cn/cggg/dfgg/gkzb/202603/t20260304_26215875.htm
杭州市上城区智慧养老综合服务采购项目,2026-03-04T11:05+08:00,杭州市上城区智慧养老综合服务平台,该项目旨在为杭州市上城区的老年人提供智慧养老综合服务。通过开发APP或微信小程序，搭建信息管理系统及呼叫中心，为签约老人发放服务终端，整合各类资源，提供数据筛选服务，实现服务组织购买和为签约老人提供全方位服务的目标。,"{'技术要求': ['开发APP或微信小程序', '搭建信息管理系统及呼叫中心'], '功能要求': ['为居住在上城区的签约老人发放服务终端', '整合各类资源为签约老人提供智慧养老综合服务', '提供数据筛选服务'], '业务场景': ['智慧养老综合服务', '服务组织购买', '为签约老人提供服务'], '性能指标': []}",2026年03月25日,杭州市上城区民政局,江亚晴,15957332375,浙江,杭州市,108.00万元,http://www.ccgp.gov.cn/cggg/dfgg/gkzb/202603/t20260304_26215718.htm
广州市轻工技师学院2026年轻工学院现代交通智能商贸产业专业实训室建设项目子项目2：智慧交通根技术实训室,2026-03-04T10:32+08:00,智慧交通根技术实训室建设,该项目旨在广州市轻工技师学院建设智慧交通根技术实训室，通过采购智能驾驶创新应用平台、智能汽车嵌入式开发套件等设备，以及实验室支撑系统和多媒体教学软件，为学生提供现代交通智能商贸产业的专业实训环境，培养智能交通领域的技术人才。,"{'技术要求': [{'名称': '智能驾驶创新应用平台', '数量': '3套', '描述': '详见采购文件'}, {'名称': '智能汽车嵌入式开发套件', '数量': '8套', '描述': '详见采购文件'}, {'名称': '智能汽车开发底盘套件', '数量': '2套', '描述': '详见采购文件'}], '功能要求': [{'名称': '实验室支撑系统', '数量': '41个', '描述': '详见采购文件'}, {'名称': '多媒体教学软件', '数量': '41个', '描述': '详见采购文件'}], '性能要求': []}",2026年03月26日,广州市轻工技师学院,曾颖妍（采购文件咨询）、何晓蕾（质疑受理）,28866437、28866163,广东,广州市,172.60万元,http://www.ccgp.gov.cn/cggg/dfgg/gkzb/202603/t20260304_26215557.htm
临江市智慧应急防汛技术服务项目,2026-03-04T08:40+08:00,临江市智慧应急防汛技术采购,该项目旨在采购智慧应急防汛技术服务，提升临江市防汛应急响应能力。项目具体内容和要求详见公开招标文件，未明确提及人工智能技术要求、功能要求或性能要求。,临江市智慧应急防汛技术服务项目中未明确提及具体的人工智能技术要求、功能要求或性能要求。项目主要涉及智慧应急防汛技术服务的采购，具体内容和要求详见公开招标文件。项目概况中提到智慧应急防汛技术服务采购，但未具体说明与人工智能相关的技术细节或应用场景。因此，无法提取与人工智能应用直接相关的核心信息。,2026年03月26日,临江市应急管理局,李慧,04395256206,吉林,临江市,129.00万元,http://www.ccgp.gov.cn/cggg/dfgg/gkzb/202603/t20260304_26215205.htm
许昌职业技术学院大数据应用实训平台建设项目,2026-03-04T10:36+08:00,无相关要求,无相关要求,无相关要求,2026年03月25日,许昌职业技术学院,李先生,0374-2968687,河南,许昌市,883.00万元,http://www.ccgp.gov.cn/cggg/dfgg/gkzb/202603/t20260304_26215591.htm
面向海上测试场船舶智能航行测试的船舶操纵仿真设备采购项目,2026-03-04T18:29+08:00,船舶智能航行测试仿真设备采购,本项目旨在采购船舶操纵仿真设备，用于海上测试场智能航行测试，预算300万，要求90天内完成交货，不接受联合体投标。,本项目为面向海上测试场船舶智能航行测试的船舶操纵仿真设备采购项目，旨在采购一套船舶操纵仿真设备，用于海上测试场船舶智能航行测试。项目预算金额为300万元人民币，合同履行期限为合同签订后90个日历天以内完成交货。项目不接受联合体投标。,2026年03月25日,南方海洋科学与工程广东省实验室（珠海）,李小姐，黄小姐,020-83548710，020-83602919,广东,珠海市,300.00万元,http://www.ccgp.gov.cn/cggg/dfgg/gkzb/202603/t20260304_26227636.htm
中老年人健康管理数字化智能服务项目,2026-03-04T10:00+08:00,无相关要求,无相关要求,无相关要求,2026年03月25日,青岛市崂山区金家岭街道社区卫生服务中心,王工,18661720131,山东,青岛市,201.00万元,http://www.ccgp.gov.cn/cggg/dfgg/gkzb/202603/t20260304_26215416.htm
