project_name,pub_time,ai_project_title,requirement_brief,requirement_desc,deadline,company_name,contact_name,contact_phone,province,city,budget,announcement_url
山西省森林草原防灭火大型设备装备购置项目,2026-03-04T17:09+08:00,山西省森林草原防灭火多功能遥控机器人采购,该项目旨在山西省购置森林草原防灭火所需的多功能遥控机器人，预算850万元，包括设备供应、安装调试、验收及售后服务。项目核心为标项五的遥控隔离带开设机，具体技术参数和要求详见招标文件第四章。,在山西省森林草原防灭火大型设备装备购置项目中，涉及人工智能应用的核心信息主要集中在标项五的遥控隔离带开设机（多功能遥控机器人）。该设备预算金额为8500000元，其采购内容包括货物的供应、安装调试、验收、售后服务等。具体采购内容、要求及详细技术参数需参考招标文件的“第四章，商务、技术要求”。由于项目信息中未提供具体的技术要求、功能要求和性能要求等详细信息，无法进一步提取与人工智能相关的具体技术、功能和业务场景。,2026年03月25日,山西省森林草原防火技术服务中心,李晋萍,19935547788,山西,太原市,608.00万元,http://www.ccgp.gov.cn/cggg/dfgg/gkzb/202603/t20260304_26218670.htm
营口市特殊教育学校沉浸式智慧互动教室设备采购项目,2026-03-03T16:31+08:00,营口市特殊教育学校AR智慧互动教室设备采购,该项目旨在为营口市特殊教育学校采购AR体感沉浸式康复训练系统，通过AI体感技术、AR技术和三维场景融合，提供沉浸式、交互式学习体验，突破传统教育局限，减轻师资压力，激发学生主动探索学习乐趣。,"{'技术要求': ['AR体感沉浸式康复训练系统以具身认知理论、体验式学习理论和情景式学习理论为基础，融合体感技术、AR技术与教育理念。', 'AR体感沉浸式康复训练系统采用AI体感技术、AR技术和三维场景融合等创新技术。', '软件内容应基于建构式教育理论，通过交互式的声音、动效、故事和游戏传递给幼儿。', '软件在技术上支持1080P分辨率自适配，在学校现有各种电教设备上均可适配。', '软件在技术上应满足对幼儿提出的问题具有随机性，防止幼儿机械模仿；画面具有丰富的触控视觉效果并可以模拟真实场景。', '软件应为单机安装版本，在无网情况下能正常使用。', '软件安装便捷，可以一键式安装，用户完全可以实现自行安装。', '空中手势识别模块：支持用手势动作来实现如弹框功能、暂停功能、播放功能、退出功能等。', '动作提示模块：系统能通过深度镜头和算法，实时的影像体验者动作进行画面同步。', '传感器智能提示模块：系统发现使用者不在传感器的感应范围，系统画面会及时出现定位提示或声音提示。', '游戏加分器模块：支持使用者操作成功或者体验失败后，系统自动增加或扣减积分计入体验者的完成度统计。', '知识点讲解：当课程出现知识要点和注意事项时，出现卡通人物进行讲解。'], '功能要求': ['AR智慧教室软件系统提供沉浸式、交互式的学习体验，突破传统教育方式和教学工具的局限。', '系统介绍游戏化教育模式，减轻师资需求压力。', '课程设计遵循游戏化原则，真正做到寓教于乐，激发学生主动探索学习的乐趣。', '系统优势包括全方位感统训练，促进大脑发育；模拟情景训练，锻炼认知能力；儿童自主练习，降低教学压力；人机交互，促进人际交往。', 'AR智慧教室软件具备课程内容、单面屏课程内容、软件内容编写、技术满足、软件安装等方面的要求。', 'AR体感沉浸式康复训练系统具备课程管理模块、课程应用模块、体感操作模块、显示设置模块、音乐系统模块等功能。'], '性能要求': ['AR体感沉浸式康复训练系统通过三维场景画面、图像、情景和声音丰富体验者的视觉、听觉感知。', '系统通过任务和游戏的设置让体验者通过看、听来刺激大脑，并用身体四肢的运动来做出反应。', '系统强化前庭刺激，抑制过敏的信息，矫治重力不安和运动企划不足的障碍。', '系统进行大肌肉的训练活动，提高前庭协调能力、增强大肌肉群肌力、四肢协调能力和反应能力。', '软件内容应包括图片、动画、视频、声音、音乐、故事、游戏等形式，画面应包含多种画风。', '软件在技术上应满足画面中的答案应随着问题的变化而相应地即时变化。', '软件应支持1080P分辨率自适配，在学校现有各种电教设备上均可适配。', '空中手势识别模块支持手势动作来实现功能控制。', '动作提示模块能实时影像体验者动作进行画面同步。', '传感器智能提示模块能及时出现定位提示或声音提示，引导体验者回到体感器识别的最佳体验区。', '游戏加分器模块能自动增加或扣减积分计入体验者的完成度统计。']}",2026年03月26日,营口市特殊教育学校,孙女士,0417-2972508,辽宁,营口市西市,45.50万元,http://www.ccgp.gov.cn/cggg/dfgg/gkzb/202603/t20260303_26213640.htm
2026年度广西现代科技馆体系科普展览服务项目,2026-03-03T16:25+08:00,广西现代科技馆AI与芯片科普展览,项目旨在为广西现代科技馆体系提供AI与芯片主题的科普展览服务，包含3套科普展览内容，预算345万，要求80日内完成展品出厂验收，并于2026年9月30日前完成布展。,"{'项目名称': '2026年度广西现代科技馆体系科普展览服务项目', 'AI相关技术要求': 'AI与芯片主题科普展览服务项目', 'AI相关功能要求': '共3套科普展览服务，具体内容详见公开招标文件。', 'AI相关业务场景': '科普展览服务', 'AI相关性能指标': {'预算金额': '3450000元', '合同履约期限': '合同签订之日起80日内完成展品出厂验收，2026年9月30日前完成布展。'}}",2026年03月24日,广西壮族自治区科学技术馆（广西青少年科技中心）,沈慧珠,0771-2023852,广西,,575.00万元,http://www.ccgp.gov.cn/cggg/dfgg/gkzb/202603/t20260303_26213535.htm
2026年流通领域（网络）产品质量监督抽查买样及直播大数据采集分析服务（重招）,2026-03-03T14:36+08:00,网络产品质量监督与直播大数据分析,该项目旨在通过AI技术提升杭州市网络产品质量监督抽查效率，实现数据采集、分析和处理，确保监督抽查任务按时保质完成。,根据提供的项目信息，该项目名称为2026年流通领域（网络）产品质量监督抽查买样及直播大数据采集分析服务（重招），采购人为杭州市市场监督管理局。项目的核心内容涉及网络产品质量监督抽查买样及直播大数据采集分析服务。具体到人工智能应用相关的核心信息，项目要求供应商能够按时保质保量完成组织并开展杭州市流通领域网上监督抽查任务，包括网上采样、样品接收、入库、取证、送检、处置、数据录入、库存样品和对账等具体事务工作。此外，项目还涉及到直播大数据的采集分析服务，这可能涉及到利用人工智能技术进行数据的采集、分析和处理，以提高监督抽查的效率和准确性。然而，项目描述中并未详细说明具体的人工智能技术要求、功能要求或性能要求，因此无法提供更具体的AI相关技术细节。,2026年03月23日,杭州市市场监督管理局,金婉娇、曹海英,0571-87211505，88219719,浙江,杭州市,228.00万元,http://www.ccgp.gov.cn/cggg/dfgg/gkzb/202603/t20260303_26212549.htm
张家口市数据和政务服务局张家口市“无证明城市”建设项目,2026-03-03T15:23+08:00,张家口市无证明城市AI系统建设,该项目旨在构建张家口市无证明城市应用系统和管理系统，实现证明、证照梳理服务和历史数据治理，对接现有系统，采集数据，并开发Office国产化文档插件，以提升政务服务效率和数据管理能力。,"{'技术要求': ['无证明城市应用系统', '无证明城市管理系统', '系统对接', '数据采集', '驾驶舱'], '功能要求': ['证明、证照梳理服务', '历史数据治理', 'Office国产化文档插件'], '业务场景': ['张家口市“无证明城市”建设'], '性能指标': []}",2026年03月26日,张家口市数据和政务服务局,乔永立,0313-7680613,河北,张家口市桥东区站前西大街16号张家口市,393.60万元,http://www.ccgp.gov.cn/cggg/dfgg/gkzb/202603/t20260303_26212872.htm
“自然资源和不动产确权登记规范化建设与数据治理”项目其他专业技术服务,2026-03-03T09:23+08:00,不动产登记数据治理与技能大赛技术支持,河北省不动产登记中心需技术服务以规范不动产登记，包括数据治理和技能大赛技术支持。,项目涉及三个标段：1标段要求委派专业人员参与项目相关工作，包括计算机、土地资源管理等；2标段要求通过软件质检和编写SQL语句人工质检等方式对不动产登记数据进行质检；3标段涉及技能大赛现场布置、技术支持等。其中，2标段的数据质检任务可能涉及人工智能技术在数据治理中的应用，如自动化的软件质检工具可能集成了机器学习算法以识别数据错误和异常。此外，技能大赛技术支持可能需要人工智能技术以实现智能分析和决策辅助。具体技术要求和性能指标需根据招标文件进一步明确。,2026年03月24日,河北省不动产登记中心,张宏,0311-83827678,河北,石家庄市,0.03万元,http://www.ccgp.gov.cn/cggg/dfgg/gkzb/202603/t20260303_26211173.htm
华东交通大学全重盾构隧道3D视觉轮廓测量与病害识别检测机器人科研设备采购项目,2026-03-03T16:55+08:00,3D视觉盾构隧道检测机器人采购,华东交通大学拟采购3D视觉轮廓测量与病害识别检测机器人，用于全重盾构隧道的检测，以提升检测效率和准确性。设备需具备3D视觉轮廓测量和病害识别检测功能，具体性能指标见附件。,"{'技术要求': '华东交通大学全重盾构隧道3D视觉轮廓测量与病害识别检测机器人科研设备采购项目要求采购的设备能够进行3D视觉轮廓测量与病害识别检测。', '功能要求': '该设备需具备以下功能：1. 3D视觉轮廓测量；2. 病害识别检测。', '业务场景': '该设备应用于全重盾构隧道的3D视觉轮廓测量与病害识别检测，以提高隧道检测的效率和准确性。', '性能指标': '具体性能指标详见公告附件，但公告中未提供附件内容，因此无法给出具体性能指标。'}",2026年03月12日,华东交通大学,艾汕辉、黄颖慧、马俊、刘玲,0791-85239887,江西,南昌市,0.02万元,http://www.ccgp.gov.cn/cggg/dfgg/gkzb/202603/t20260303_26213922.htm
骨科关节机器人(二次),2026-03-03T10:53+08:00,骨科关节手术辅助机器人系统,本项目旨在构建一套骨科关节机器人系统，由机械臂台车和光学台车组成，集成控制系统和机械臂，以辅助执行手术。系统需满足招标文件中的具体技术需求和服务要求。,"{'技术要求': '骨科关节机器人整机由机械臂台车（含控制系统）、光学台车两部分以上组成，整套系统要带有机械臂，可辅助执行手术等。', '功能要求': '骨科关节机器人需具备辅助执行手术的功能，具体技术需求或服务要求详见招标文件。', '性能要求': '无具体性能要求描述。'}",2026年03月25日,福建省立医院,丁双双、张小青、廖丽松、张博艺,0591-88318332、87616211转806,福建,福州市,120.00万元,http://www.ccgp.gov.cn/cggg/dfgg/gkzb/202603/t20260303_26211726.htm
迎泽西大街（春居路-晋祠路）市政配套设施改造工程智慧管网和物联一体化设备购置安装,2026-03-03T23:50+08:00,无相关要求,无相关要求,无相关要求,2026年03月24日,太原市市政公共设施建设管理中心（差额）,张冬恺,13403453655,山西,太原市,250.15万元,http://www.ccgp.gov.cn/cggg/dfgg/gkzb/202603/t20260303_26215090.htm
城轨全自动运行智慧实训室升级改造项目,2026-03-03T23:15+08:00,城轨全自动运行智慧实训室技术升级,该项目旨在对城轨全自动运行智慧实训室进行技术升级改造，提升实训室的智能化水平，以更好地满足城轨全自动运行技术的教学和实训需求。,根据提供的项目信息和附件内容，该项目为城轨全自动运行智慧实训室升级改造项目，主要涉及城轨全自动运行智慧实训室的技术升级改造。项目中并未明确提及具体的人工智能技术要求、功能要求或性能要求。因此，无法从提供的信息中提取与人工智能应用相关的核心信息。,2026年03月24日,陕西铁路工程职业技术学院,杨翠 任亚明 魏存刚,029-89289291,陕西,渭南市,704.00万元,http://www.ccgp.gov.cn/cggg/dfgg/gkzb/202603/t20260303_26215086.htm
连州市智慧气象防灾减灾第一道防线示范市建设项目（一期）,2026-03-03T18:55+08:00,无相关要求,无相关要求,无相关要求,2026年03月24日,广东省连州市气象局,何女士,0763-3813002-2407,广东,清远市连州市,497.82万元,http://www.ccgp.gov.cn/cggg/dfgg/gkzb/202603/t20260303_26218303.htm
乌鲁木齐市第十五小学教室智慧黑板、教师计算机项目,2026-03-03T18:18+08:00,乌鲁木齐市第十五小学智慧黑板和计算机采购,采购智慧黑板和教师计算机，提升教学信息化水平。,无相关要求,2026年03月23日,乌鲁木齐市第十五小学校,张晶、吴一荣,0991-4166206,新疆,乌鲁木齐市,84.05万元,http://www.ccgp.gov.cn/cggg/dfgg/gkzb/202603/t20260303_26214615.htm
广州市皮肤病医院智慧服务信息化建设项目,2026-03-03T17:31+08:00,广州市皮肤病医院智慧服务信息化建设,建设智慧服务信息化项目，提升医院服务效率和质量。,"广州市皮肤病医院智慧服务信息化建设项目旨在通过信息化手段提升医院服务的智能化水平，改善患者就医体验。项目预算为6,385,500元，实施周期15个月，要求系统12个月内完成开发上线，试运行3个月后进行项目验收。项目不接受联合体投标，供应商需满足政府采购法规定的条件，包括具备独立承担民事责任的能力、依法缴纳税收和社会保障资金的良好记录、良好的商业信誉和健全的财务会计制度、履行合同所必需的设备和专业技术能力等。项目具体技术规格、参数及要求详见采购文件。",2026年03月24日,广州市皮肤病医院,欧阳晋杰（采购文件咨询）、何晓蕾（质疑受理）,28866424；28866163,广东,广州市,638.55万元,http://www.ccgp.gov.cn/cggg/dfgg/gkzb/202603/t20260303_26214316.htm
新龙县县域医共体智慧医疗信息化建设项目,2026-03-03T17:30+08:00,新龙县县域医共体智慧医疗信息化建设项目,构建县域医共体智慧医疗信息化平台，实现数据集成、智能辅助诊断、术语管理等，提升医疗服务效率和质量。,新龙县县域医共体智慧医疗信息化建设项目聚焦于构建一个集成化的医疗信息化平台，该平台将整合医共体数据中心、业务协同中心、区域影像中心等多个系统，实现数据的统一管理和智能分析。项目中涉及人工智能的核心要求包括：1. 术语管理：建立术语库，整合国际和国内医学术语标准，构建概念-术语-映射三层架构，实现术语的自动识别、提取和映射，为AI诊疗提供标准化数据基础。2. 智能辅助诊断系统(CDSS)：在16家基层医院部署，利用AI技术辅助医生诊断，提高诊断准确性。3. 数据元和值域管理：通过数据元全维度管控和值域映射，实现数据标准化，为AI分析提供高质量的数据输入。4. 基础服务：包括个人注册服务、医疗卫生人员注册服务等，为AI应用提供必要的基础数据支持。5. 异常监控与预警：利用AI技术实时监控标准使用情况，自动触发预警并推送至管理员，提升系统的智能化水平。项目旨在通过AI技术提升医疗服务的效率和质量，实现医疗资源的优化配置。,2026年03月24日,新龙县卫生健康局,马先生,0836-8125501,四川,,246.00万元,http://www.ccgp.gov.cn/cggg/dfgg/gkzb/202603/t20260303_26214295.htm
大连理工大学校际客车租赁服务采购项目,2026-03-03T16:53+08:00,校际客车租赁服务智慧化系统建设,建设服务于客车租赁的智慧化服务系统，提升校际交通服务效率和质量。,大连理工大学校际客车租赁服务采购项目中，明确提出了需配备服务于客车租赁服务的智慧化服务系统建设的需求。具体要求如下：1. 系统需实现对校际班车（工作日班车、周末班车、辅修课用车）和活动用车的智能调度和管理，提高车辆使用效率。2. 系统应支持对车辆运行状态的实时监控，包括位置、速度、行驶路线等，以确保行车安全。3. 系统应能自动记录和统计车辆使用情况，为成本核算和决策提供数据支持。4. 系统应支持与用户（师生）的互动，如在线预约、查询、评价等，提升用户体验。5. 系统应具备一定的数据分析能力，对用车需求、用户满意度等进行分析，为优化服务提供依据。6. 系统应与学校现有信息系统（如教务、学工等）实现数据对接和业务协同，实现信息共享。7. 系统应支持多终端访问，包括PC端和移动端，方便用户随时随地使用。8. 系统应具备良好的扩展性，能够根据学校发展需要进行功能升级和扩展。以上要求体现了项目对人工智能技术在交通服务领域的应用需求，旨在通过智慧化系统建设，提升校际交通服务的智能化、便捷化水平。,2026年03月24日,大连理工大学,吴靖、张筱鑫,0411-84350112、84651726,辽宁,大连市,190.00万元,http://www.ccgp.gov.cn/cggg/zygg/gkzb/202603/t20260303_26213798.htm
怀远县路灯节能改造建设项目（第二批）,2026-03-03T16:35+08:00,怀远县路灯节能改造建设项目（第二批）,怀远县路灯节能改造项目，旨在通过采购高光效LED路灯及智慧化管控设备，实现节能和智慧化管控升级。,怀远县路灯节能改造建设项目（第二批）的核心目标是响应国家节能减排政策，同时满足市民出行需求，通过采购400台高光效LED路灯、约3000套单灯控制器、33台集中控制器及配套电缆等设备，实现路灯的节能和智慧化管控升级。具体技术要求和功能包括：1. 高光效LED路灯，以提高照明效率，降低能耗；2. 单灯控制器和集中控制器，实现对路灯的智能化控制和管理，包括远程监控、故障诊断、节能调度等功能；3. 配套电缆等基础设施，保障设备稳定运行。项目要求在合同签订后120日内完成到货、安装和调试工作，以确保路灯系统的及时升级和投入使用。,2026年03月24日,怀远县城市管理局,杨洪,18158988513,安徽,,150.00万元,http://www.ccgp.gov.cn/cggg/dfgg/gkzb/202603/t20260303_26213687.htm
辽阳市中心医院物业服务保洁项目,2026-03-03T15:30+08:00,辽阳市中心医院物业服务保洁项目,无人工智能相关要求，项目主要涉及医院物业服务保洁,无相关要求,2026年03月24日,辽阳市中心医院,唐晓光,0419-3868654,辽宁,辽阳市,391.42万元,http://www.ccgp.gov.cn/cggg/dfgg/gkzb/202603/t20260303_26212928.htm
改善就医环境改造修缮项目（配套设备部分）,2026-03-03T15:16+08:00,改善就医环境改造修缮项目配套设备,该项目旨在通过采购配套设备改善就医环境，无明确提及人工智能应用。,"改善就医环境改造修缮项目（配套设备部分）主要涉及医院环境改造所需的各类设备采购，包括柜类、台桌类、金属加工设备、风机、塑料制品、电气设备等。项目中并未提及人工智能相关的技术要求、功能要求或性能指标。主要目标是通过采购和安装这些设备，提升医院就医环境，提高医疗服务质量。项目预算金额为1,198,683.89元，要求供应商具备相应的资质和能力，但未涉及人工智能领域。",2026年03月24日,普宁市人民医院,陈女士,0663-8889890,广东,普宁市,119.87万元,http://www.ccgp.gov.cn/cggg/dfgg/gkzb/202603/t20260303_26212785.htm
安徽财贸职业学院智慧图书馆建设项目（一期）,2026-03-03T15:01+08:00,安徽财贸职业学院智慧图书馆建设项目（一期）,构建智慧图书馆，提升图书馆智能化管理与服务水平。,无相关要求,2026年03月24日,安徽财贸职业学院,许磊,0551-63839731,安徽,合肥市,67.00万元,http://www.ccgp.gov.cn/cggg/dfgg/gkzb/202603/t20260303_26212685.htm
吉水县职业中等专业学校一期建设项目-二次装修智慧化采购,2026-03-03T14:50+08:00,吉水县职业中等专业学校智慧化采购,该项目旨在为吉水县职业中等专业学校一期建设项目提供智慧化二次装修，包括信息化设备的采购与安装。,吉水县职业中等专业学校一期建设项目-二次装修智慧化采购项目，主要涉及其他信息化设备的采购，具体技术需求和服务要求详见公告附件。项目预算金额为5922123.16元，最高限价相同。合同履行期限为自合同签订生效后90日内完成供货、安装、调试、培训等，确保产品一切正常，并通过验收交付使用。本项目不接受联合体投标。申请人需满足《中华人民共和国政府采购法》第二十二条规定的条件，包括具有独立承担民事责任的能力、良好的商业信誉和健全的财务会计制度、履行合同所必需的设备和专业技术能力等。此外，投标人被“信用中国”网站列入失信被执行人或重大税收违法案件当事人名单、或被中国政府采购网列入政府采购严重违法失信行为记录名单的，不得参加本项目的政府采购活动。本项目非专门面向中小企业采购，但投标人所投产品的制造商全部符合《中小企业划型标准规定》的小微企业，并提供小微企业声明函，将享受投标价格优惠10%的“价格评审优惠”扶持政策。,2026年03月13日,吉水县教育体育局,陈女士,18179608236,江西,,0.06万元,http://www.ccgp.gov.cn/cggg/dfgg/gkzb/202603/t20260303_26212630.htm
深圳市公安局南山分局信访多维融合智慧平台开发服务项目,2026-03-03T14:20+08:00,深圳市公安局南山分局信访多维融合智慧平台,构建信访多维融合智慧平台，提升信访工作效率和智能化水平。,无相关要求,2026年03月16日,深圳市公安局南山分局,李明,18188613133,广东,,136.86万元,http://www.ccgp.gov.cn/cggg/dfgg/gkzb/202603/t20260303_26212427.htm
丰台区公园管理中心活动噪音治理项目,2026-03-03T11:16+08:00,丰台区公园智慧舞场系统建设,建设智慧舞场系统，实现声音分区控制和定向传播，降低噪音影响。,丰台区公园管理中心活动噪音治理项目旨在通过建设智慧舞场系统，采用波束形成定向发声技术和局域声场控制算法，从源头进行声音传播管控，实现声音分区控制和定向传播。具体技术要求包括：1. 在丰台花园、万芳亭公园共安装24套智慧舞场系统，每套含指向性可调波束控制单元、工业级10.1寸多功能触摸屏。2. 配备后端智慧舞场系统管理平台和前端智慧舞场应用小程序。3. 系统应能实现声音分区控制、定向传播，使设备发出的声音集中在固定区域，满足舞者对音乐节奏、音量的使用需求，同时无需自带音箱。4. 通过技术手段使两侧、后方、上方的声压低于正前方声压20dB以上，实现各活动团队同时播放音乐互不干扰，降低对周边群众生活工作的环境噪音影响。项目预算183.312万元，要求合同签订后60日内完成交货、安装调试并验收合格。,2026年03月24日,北京市丰台区公园管理中心,刘思琪,010-62688241,北京,北京市,183.31万元,http://www.ccgp.gov.cn/cggg/dfgg/gkzb/202603/t20260303_26211854.htm
常州市武进区数字政府一体化平台建设项目（地理信息智慧应急模块）,2026-03-03T10:37+08:00,武进区数字政府地理信息智慧应急模块,构建地理信息智慧应急模块，提升安全管理信息化水平。,本项目旨在通过建设地理信息智慧应急模块，解决武进区生产经营单位安全生产监管难题，实现信息透明、数据上图、视频组会实时调度等功能。具体要求包括：1. 针对粉尘涉爆、厂中厂、社会面小场所等重点领域及自然灾害领域进行重点排查；2. 实现各类数据实时视频的实时监控；3. 及时解决处理隐患问题，遏制事故发生；4. 有效减少重大自然灾害人员财产损失。项目需在6个月内建设完成并通过验收，无特定人工智能技术要求，但需利用信息化手段提升安全管理效率和效果。,2026年03月24日,常州市武进区数据局（本级）,杨瀚宸,0519-88068619,江苏,,185.18万元,http://www.ccgp.gov.cn/cggg/dfgg/gkzb/202603/t20260303_26211608.htm
