project_name,pub_time,ai_project_title,requirement_brief,requirement_desc,deadline,company_name,contact_name,contact_phone,province,city,budget,announcement_url,location_text
宜昌市三峡高级中学学生宿舍楼建设项目弱电安装工程（第2次采购）,2026-03-18T17:22+08:00,无相关要求,无相关要求,无相关要求,2026-03-19,宜昌市三峡高级中学,郭星星,15172379527,湖北,宜昌市,90.46万元,http://www.ccgp.gov.cn/cggg/dfgg/gkzb/202603/t20260318_26285323.htm,宜昌市夷陵区小溪塔锦江大道30号
同江东港海关监管场所和国际公路运输（tir）同江东港集结中心建设项目,2026-03-18T17:05+08:00,海关监管场所智能检测与人脸识别系统,建设同江东港海关监管场所和国际公路运输集结中心，集成视频监控、集装箱号自动识别、电子车牌识别等技术，实现围网区域周界防范智能检测、人脸识别比对及人员数量统计报警功能，提升监管效率和安全性。,"【背景概述】
同江东港海关监管场所和国际公路运输（TIR）同江东港集结中心建设项目，采购人为同江市商务和口岸局，预算金额3,890,000.00元，合同履行期限自合同签订之日起60日，项目包含视频监控安装、集装箱号自动识别、电子车牌识别等14项内容。

1. 围网区域周界防范智能检测：一体化球机通过深度学习算法提供精准的人车分类检测，在限制区域基于对象类型进行绊线入侵、区域入侵、停车检测等智能检测。内置2颗GPU芯片支持深度学习算法，有效提升检测准确率，支持枪球联动及GPS/北斗经纬度定位。

2. 人脸识别检测与比对：枪式摄像机支持人脸角度过滤、人脸检测功能，支持1000张人脸底库的人脸比对。

3. 人员数量智能统计与报警：支持对进入、离开人员进行数量统计，支持区域内人员数量统计，支持排队管理，各项功能均可配置4条规则。支持滞留报警、排队人数、排队时间统计并联动报警，可显示及输出日、月、年统计报表。",2026-04-08,同江市商务和口岸局,邱先生,13114541310,黑龙江,同江市,389.00万元,http://www.ccgp.gov.cn/cggg/dfgg/gkzb/202603/t20260318_26285070.htm,同江市大直路83号五楼
广州航海学院远程抄表和学生公寓宿舍用电预付费系统建设项目(二次),2026-03-18T16:41+08:00,无相关要求,无相关要求,无相关要求,2026-04-08,广州航海学院,吴女士/李女士,020-87651688-551/705,广东,广州市,258.14万元,http://www.ccgp.gov.cn/cggg/dfgg/gkzb/202603/t20260318_26284694.htm,广州市黄埔区红山三路101号
涉重金属突发环境事件应对能力建设项目,2026-03-18T16:33+08:00,AI辅助重金属环境事件应急处置能力建设,利用AI技术构建高精度数字高程模型，智能识别非主干水系特征，快速构建应急指挥模型，提升环境事件应急处置效率。,"【背景概述】

1、引入人工智能（AI）与多源数据融合模型，基于高精度数字高程模型（DEM）和人工智能（AI）技术，完成细小水系智能识别体系分析构建，精准提取""非主干""水文水系特征结构，支撑快速构建应急指挥模型，提升全区突发环境事件应急处置效率。",2026-04-09,广西壮族自治区环境应急与事故调查中心,朱秋玲、黄丽华、唐瑭,0771-3126896,广西,南宁市,151.00万元,http://www.ccgp.gov.cn/cggg/dfgg/gkzb/202603/t20260318_26284588.htm,南宁市青秀区佛子岭路16号
沈阳市第七人民医院关于沈阳市中医药传承创新发展示范项目购置医疗设备,2026-03-18T16:31+08:00,中医医疗设备智能分析系统采购,沈阳市第七人民医院采购医疗设备，包括玻片扫描影像系统、共聚焦显微镜、中医四诊仪等，要求设备具备图像质量智能评价、脉象分析图表显示、自动脉象分析和舌诊量化分析功能，并提供软件操作截图证明。,"【背景概述】
沈阳市第七人民医院关于沈阳市中医药传承创新发展示范项目购置医疗设备，采购玻片扫描影像系统、在体反射式共聚焦显微镜、中医四诊仪（便携）、中医四诊仪等设备。

1. 玻片扫描影像系统支持对每张切片进行图像质量智能评价，不合格的切片可以重新扫描，提高工作效率，需提供相关软件操作截图证明。

2. 中医四诊仪（便携）脉诊模块能在报告里用图表显示脉象分析，至少要有脉位偏差图、脉率偏差图、脉型分析图，对比左右手六部脉象判断脏腑整体情况，需提供设备配套软件截图证明。

3. 中医四诊仪（便携）能自动分析左手、右手寸关尺的脉象特点，最后给出整体脉象结论。

4. 中医四诊仪（便携）舌诊模块能在报告里量化分析舌头情况，包括舌色、苔色、胖瘦、厚薄、腐腻、老嫩、点刺、齿痕，既有文字判断，也有具体数值，需提供设备配套软件截图证明。",2026-04-09,沈阳市第七人民医院,薛春阳,13109886816,辽宁,沈阳市,354.00万元,http://www.ccgp.gov.cn/cggg/dfgg/gkzb/202603/t20260318_26284560.htm,沈阳市和平区东纬路13号
残疾人康复就业创业和培训项目（残保金）(四次),2026-03-18T16:20+08:00,无相关要求,无相关要求,无相关要求,2026-04-08,甘肃省残疾人辅助器具资源中心,王冬妮,13893253240,甘肃,,40.02万元,http://www.ccgp.gov.cn/cggg/dfgg/gkzb/202603/t20260318_26284398.htm,甘肃省兰州新区白龙江街1136-3号(国家辅助器具西北区域中心)
自然资源执法快速响应机制采购项目,2026-03-18T16:06+08:00,自然资源执法AI快速响应机制建设,构建基于AI技术的自然资源执法快速响应机制，通过AI筛查技术提取疑似违法线索，实现对重点线索的快速实地测绘和成果形成，提高执法效率和准确性。,"【背景概述】
自然资源执法快速响应机制采购项目，预算190万元分A包（104万元）和B包（86万元）。A包服务内容为疑似违法线索提取，采用人工智能+AI筛查方式；B包为重点线索实地测绘并形成成果。

1. A包负责对疑似违法线索进行提取，采用人工智能+AI筛查技术。",2026-04-08,大连市自然资源行政执法队,王琳,王琳、丁晓琳、柳扬,辽宁,大连市,190.00万元,http://www.ccgp.gov.cn/cggg/dfgg/gkzb/202603/t20260318_26284231.htm,大连市中山区中青街158号
冀南技师学院国家级高技能人才培训基地建设设备采购项目（智能控制运行与维护实训系统）,2026-03-18T16:04+08:00,无相关要求,无相关要求,无相关要求,2026-04-09,冀南技师学院,郝晨、董京、谢乔旭,010-81168179,河北,邯郸市,74.38万元,http://www.ccgp.gov.cn/cggg/dfgg/gkzb/202603/t20260318_26284196.htm,邯郸市冀南新区芳华路1号
2026年设备购置项目,2026-03-18T15:50+08:00,无相关要求,无相关要求,无相关要求,2026-04-08,北京市丰台区新村社区卫生服务中心,满玉娴,010-63832791,北京,北京市,183.82万元,http://www.ccgp.gov.cn/cggg/dfgg/gkzb/202603/t20260318_26284047.htm,北京市丰台区首经贸北路8号4号楼
张北县职教中心数字产品检测与维护竞赛平台购置项目,2026-03-18T15:44+08:00,无相关要求,无相关要求,无相关要求,2026-04-08,张北县职教中心,王延超,0313-2187333,河北,,48.50万元,http://www.ccgp.gov.cn/cggg/dfgg/gkzb/202603/t20260318_26283993.htm,张北县职教中心公园路88号
电子卷宗集约管理中间柜,2026-03-18T14:51+08:00,无相关要求,无相关要求,无相关要求,2026-04-08,宁安市人民法院,伦晓明,0453-7680853,黑龙江,牡丹江市宁安市,44.20万元,http://www.ccgp.gov.cn/cggg/dfgg/gkzb/202603/t20260318_26283479.htm,黑龙江省牡丹江市宁安市古塔东街18号
苏州市社会福利总院医疗和养老业务系统升级改造,2026-03-18T14:35+08:00,无相关要求,无相关要求,无相关要求,2026-04-09,苏州市社会福利总院,宋工,0512-69829956,江苏,苏州市,409.00万元,http://www.ccgp.gov.cn/cggg/dfgg/gkzb/202603/t20260318_26283339.htm,苏州市相城区新福路700号
东南大学信息科学与工程学院智能计算平台采购,2026-03-18T14:07+08:00,无相关要求,无相关要求,无相关要求,2026-04-08,东南大学,黄雪梅,025-52705219,江苏,南京市,73.00万元,http://www.ccgp.gov.cn/cggg/zygg/gkzb/202603/t20260318_26283193.htm,江苏省南京市玄武区四牌楼2号
高质量发展-学科建设-长春工程学院智能车辆专业实验室建设项目,2026-03-18T13:08+08:00,无相关要求,无相关要求,无相关要求,2026-04-20,长春工程学院,王苗苗,80578262,吉林,长春市,259.00万元,http://www.ccgp.gov.cn/cggg/dfgg/gkzb/202603/t20260318_26283025.htm,长春市宽平大路395号
全国农作物病虫疫情监测中心内蒙古分中心锡林郭勒盟田间监测点建设项目,2026-03-18T11:58+08:00,无相关要求,无相关要求,无相关要求,2026-04-08,锡林郭勒盟农牧技术推广中心,张超,0479-3905583,内蒙古,锡林浩特市,268.85万元,http://www.ccgp.gov.cn/cggg/dfgg/gkzb/202603/t20260318_26282874.htm,锡林浩特市察哈尔大街东段575号
县应急局元坝大桥智能监控建设采购项目,2026-03-18T10:31+08:00,无相关要求,无相关要求,无相关要求,2026-04-08,苍溪县应急管理局,陈老师,0839-5885655,四川,广元市,40.46万元,http://www.ccgp.gov.cn/cggg/dfgg/gkzb/202603/t20260318_26282310.htm,四川省广元市苍溪县陵江镇肖家坝大道1号
南宁海关2026年进出境动植物检疫能力提升工程项目采购项目,2026-03-18T10:11+08:00,无相关要求,无相关要求,无相关要求,2026-04-09,海关总署物资装备采购中心,任先生/女士,010-65195831,北京,北京市,114.00万元,http://www.ccgp.gov.cn/cggg/zygg/gkzb/202603/t20260318_26282136.htm,北京市东城区金宝街61号鑫海锦江大酒店
智慧校园应用平台统一认证和系统功能提升项目,2026-03-18T19:50+08:00,无相关要求,无相关要求,无相关要求,2026-04-07,可克达拉职业技术学院,谭森龙,13669989868,新疆,新疆维吾尔自治区可克达拉市,220.00万元,http://www.ccgp.gov.cn/cggg/dfgg/gkzb/202603/t20260318_26286356.htm,新疆维吾尔自治区可克达拉市汉江东路1357号
南昌大学附属康复医院两院区一体化智慧医疗信息化建设（银医合作）项目,2026-03-18T18:00+08:00,无相关要求,无相关要求,无相关要求,2026-03-27,南昌大学附属康复医院,胡涛、万里阳,0791-86259341,江西,南昌市,0.28万元,http://www.ccgp.gov.cn/cggg/dfgg/gkzb/202603/t20260318_26285724.htm,南昌市西湖区广场南路133号
智慧黑板及教室扩音设备、特色部室及智慧阅览室设备,2026-03-18T17:33+08:00,无相关要求,无相关要求,无相关要求,2026-04-08,西安市昆仑中学,庞冰倩、陈钊、刘强,029-88228899-653、657,陕西,西安市,400.00万元,http://www.ccgp.gov.cn/cggg/dfgg/gkzb/202603/t20260318_26285495.htm,西安市新城区长乐中路49号
宿豫区智慧水务平台运维（2026-2027年）项目,2026-03-18T17:09+08:00,无相关要求,无相关要求,无相关要求,2026-04-08,宿迁市宿豫区住房和城乡建设局（本级）,陈静,0527-88855085,江苏,,590.65万元,http://www.ccgp.gov.cn/cggg/dfgg/gkzb/202603/t20260318_26285143.htm,宿豫区韶山路3号
青海省级矿山智慧监管监察平台项目,2026-03-18T16:47+08:00,无相关要求,无相关要求,无相关要求,2026-04-08,青海省应急管理厅,周泉,详见公告正文,青海,,105.00万元,http://www.ccgp.gov.cn/cggg/dfgg/gkzb/202603/t20260318_26284766.htm,无
“吉林智慧人社”运维项目,2026-03-18T13:08+08:00,无相关要求,无相关要求,无相关要求,2026-04-13,吉林省人力资源和社会保障信息管理中心,王博,88690016,吉林,,51.70万元,http://www.ccgp.gov.cn/cggg/dfgg/gkzb/202603/t20260318_26283024.htm,长春南关区亚泰大街3336号
广州铁路职业技术学院智慧职教网络课程平台软件服务项目,2026-03-18T11:37+08:00,无相关要求,无相关要求,无相关要求,2026-04-08,广州铁路职业技术学院,伍工,020-38931901-811,广东,广州市,57.00万元,http://www.ccgp.gov.cn/cggg/dfgg/gkzb/202603/t20260318_26282754.htm,广州市增城区科德大道198号
智慧教学平台（含网络通识课程）软件服务项目,2026-03-18T11:36+08:00,无相关要求,无相关要求,无相关要求,2026-04-08,广州铁路职业技术学院,伍工,020-38931901-811,广东,广州市,135.00万元,http://www.ccgp.gov.cn/cggg/dfgg/gkzb/202603/t20260318_26282745.htm,广州市增城区科德大道198号
新能源学院智慧教学环境建设项目,2026-03-18T09:49+08:00,无相关要求,无相关要求,无相关要求,2026-04-08,内蒙古工业大学,李伟奇；质疑联系人：阮佳（邮寄质疑应邮寄给质疑联系人）,0471-5332614；质疑联系电话：0471-5332613,内蒙古,,427.44万元,http://www.ccgp.gov.cn/cggg/dfgg/gkzb/202603/t20260318_26282026.htm,内蒙古工业大学
更换学生公寓楼门卫生间门及教室智慧黑板采购项目,2026-03-18T09:08+08:00,无相关要求,无相关要求,无相关要求,2026-04-09,延长县高级中学,高工,0911-8953397,陕西,,215.96万元,http://www.ccgp.gov.cn/cggg/dfgg/gkzb/202603/t20260318_26281876.htm,延长县人民法院对面
平顶山市新城区行政服务中心数字智慧办公软硬件设备采购项目,2026-03-18T08:49+08:00,无相关要求,无相关要求,无相关要求,2026-04-08,平顶山市新城区行政服务中心,孙女士,0375-7502336 17527515377,河南,,140.00万元,http://www.ccgp.gov.cn/cggg/dfgg/gkzb/202603/t20260318_26281840.htm,平顶山新城区宏图路中段管委会院内
AI+第一性原理超算集群,2026-03-18T14:33+08:00,无相关要求,无相关要求,无相关要求,2026-04-08,南京大学,黄丹,025-84531274,江苏,南京市,420.00万元,http://www.ccgp.gov.cn/cggg/zygg/gkzb/202603/t20260318_26283282.htm,南京市栖霞区仙林大道163号
中山市政务服务智能算力服务采购项目,2026-03-18T17:47+08:00,无相关要求,无相关要求,无相关要求,2026-04-08,中山市政务服务和数据管理局,陈丹燕,0760-88383266,广东,中山市,185.00万元,http://www.ccgp.gov.cn/cggg/dfgg/gkzb/202603/t20260318_26286926.htm,广东省中山市东区兴文路7号
汕尾市城区“数字城市”信息化建设项目(一期)-智慧出行平台建设项目,2026-03-18T18:09+08:00,无相关要求,无相关要求,无相关要求,2026-04-09,汕尾市城区政务服务和数据管理局,徐先生,0660-3875333,广东,汕尾市,243.52万元,http://www.ccgp.gov.cn/cggg/dfgg/gkzb/202603/t20260318_26291662.htm,广东省汕尾市城区香洲街道通港路365号原富临酒店五楼、六楼
河津市公安局武警河津中队开展执勤智能化试点建设项目,2026-03-17T00:00+08:00,无相关要求,无相关要求,无相关要求,2026-04-07,河津市公安局,李女士,15581918678,山西,河津市,123.21万元,http://www.ccgp.gov.cn/cggg/dfgg/gkzb/202603/t20260317_26276358.htm,河津市万春街西
黄山学院工业网络与协同控制实训系统采购项目,2026-03-17T11:30+08:00,无相关要求,无相关要求,无相关要求,2026-04-08,黄山学院,俞工,0559-2321558,安徽,黄山市,440.00万元,http://www.ccgp.gov.cn/cggg/dfgg/gkzb/202603/t20260317_26277436.htm,安徽省黄山市屯溪区西海路39号
黄山学院大数据统计分析综合实训设备采购项目,2026-03-17T15:18+08:00,无相关要求,无相关要求,无相关要求,2026-04-09,黄山学院,周工,0559-2334139,安徽,黄山市,546.00万元,http://www.ccgp.gov.cn/cggg/dfgg/gkzb/202603/t20260317_26278410.htm,安徽省黄山市屯溪区西海路39号
黄山学院大数据开发与科研实验室设备采购项目,2026-03-17T14:51+08:00,无相关要求,无相关要求,无相关要求,2026-04-07,黄山学院,周工,0559-2334139,安徽,黄山市,552.00万元,http://www.ccgp.gov.cn/cggg/dfgg/gkzb/202603/t20260317_26278200.htm,安徽省黄山市屯溪区西海路39号
深圳市大数据资源管理中心深圳市政务智能算力服务（2026年）,2026-03-17T22:15+08:00,无相关要求,无相关要求,无相关要求,2026-04-02,深圳市大数据资源管理中心,蒋工,13632970157,广东,深圳市福田区福中路208号城市,640.00万元,http://www.ccgp.gov.cn/cggg/dfgg/gkzb/202603/t20260317_26281543.htm,深圳市福田区福中路208号城市数字中心
北京邮电大学校务数据供给平台建设项目,2026-03-17T18:40+08:00,无相关要求,无相关要求,无相关要求,2026-04-08,北京邮电大学,王蕾蕾、赵文宇、吕绍山、周洁琼、王爽、王希、孙恺宁,010－61196170,北京,北京市,210.00万元,http://www.ccgp.gov.cn/cggg/zygg/gkzb/202603/t20260317_26280993.htm,北京市海淀区西土城路10号
专病数据库采购,2026-03-17T17:03+08:00,科研级专病数据库平台建设,整合多模态数据，运用自然语言处理技术构建数据治理体系，形成标准化专病科研数据库，提升临床研究分析质量与科研效率。,"【背景概述】
建设科研级专病数据库平台，整合临床、影像、病理、基因等多模态数据，运用自然语言处理等技术构建数据治理体系，形成标准化专病科研数据库，提升临床研究分析质量与科研效率，助力医院高质量发展。

1、利用自然语言处理技术，通过科研通用数据模型将医院数据统一治理到规范化的科研临床数据库中，实现对疾病相关临床数据资料的归一化集中管理。",2026-04-08,广西医科大学第一附属医院,蒙颖、郑辉海,0771-2023875,广西,广西南宁市,387.00万元,http://www.ccgp.gov.cn/cggg/dfgg/gkzb/202603/t20260317_26279985.htm,广西南宁市双拥路6号
智慧防汛及调度管理子系统建设项目,2026-03-17T16:10+08:00,智慧防汛及调度管理AI系统建设,构建AI智算核心支撑体系，实现水文智能预报、防汛视觉智能识别、数据融合分析等，提升防汛指挥和水安全联排联调管理能力。,"【背景概述】
上海面临上游洪水、下游高潮、暴雨台风等多重影响，防汛任务艰巨。2024年市领导专题调研要求推进防汛防台指挥能力升级。项目依托新一代信息技术体系，围绕""数据贯通、智能驱动、协同共治""，应用数字孪生、AI视觉识别、多源数据融合等手段，实现""感知-分析-决策-执行""全链条河湖智慧管理，提升智慧化防汛指挥和水安全联排联调管理能力。

1. 建设AI智算核心支撑体系，包括防汛智能体、防汛视觉智能模型应用、防汛数据与知识融合分析及智能应用，为系统提供AI算力与智能分析能力。

2. 建设水文智能预报分析功能模块，开展关键期水文智能融合预报分析，作为具体应用承载及数据来源。

3. 建设防汛视觉智能大模型、防汛智能体大模型、防汛数据与知识融合分析及智能应用大模型，形成AI智算和知识层。

4. 应用AI视觉识别技术，实现河湖问题智能发现、精准溯源、高效处置闭环机制，助力河湖管理从""被动响应""向""主动防控""转变。

5. 建设YQ智能监控应用模块，提升YQ研判精度，实现防汛预警、灾情发现、响应处置等环节全过程覆盖。

6. 拓展积水感知能力，通过智能视觉识别等技术手段提升城市积水监测与感知覆盖范围。",2026-04-07,上海市大数据中心,张泽平,021-35968030,上海,上海市,229.00万元,http://www.ccgp.gov.cn/cggg/dfgg/gkzb/202603/t20260317_26279092.htm,上海市大数据中心
2026年度生态环境示范区大气污染防治技术咨询服务项目,2026-03-17T14:44+08:00,无相关要求,无相关要求,无相关要求,2026-04-07,长安区人民政府青园街道办事处本级,周凯凯,0311-67593318,河北,石家庄市,900.00万元,http://www.ccgp.gov.cn/cggg/dfgg/gkzb/202603/t20260317_26278130.htm,石家庄市长安区谈南路19号
华中科技大学同济医学院附属同济医院内窥镜手术控制系统及附件（达芬奇手术机器人）维保,2026-03-17T14:31+08:00,无相关要求,无相关要求,无相关要求,2026-04-07,华中科技大学同济医学院附属同济医院,洪经理、王经理、祝经理,027-87271918,湖北,武汉市,474.00万元,http://www.ccgp.gov.cn/cggg/zygg/gkzb/202603/t20260317_26278000.htm,武汉市硚口区解放大道1095号
交通机器视觉与智能感知实验室,2026-03-17T13:49+08:00,无相关要求,无相关要求,无相关要求,2026-04-09,吉林交通职业技术学院,曹东,18943141514,吉林,长春市,273.00万元,http://www.ccgp.gov.cn/cggg/dfgg/gkzb/202603/t20260317_26277825.htm,长春市高新区电台街63号
公立医院高质量发展示范项目-长春市智慧医疗能力提升项目（三次）,2026-03-17T19:03+08:00,长春市智慧医疗AI平台及VTE系统建设,构建市级数智健康大脑，实现医疗健康数据互联互通。建设AI平台，内嵌VTE系统AI语义识别工具，运用知识图谱技术实现自动评估与评分，提供预防措施智能推荐，自动抓取与核查医嘱，提升医疗服务智能化水平。,"【背景概述】
本项目遵循健康中国2030规划纲要和深化医药卫生体制改革2024年重点工作任务等政策框架，依托数字健康新型基础设施，构建市级数智健康大脑，实现全市医疗健康数据互联互通、业务协同和信息共享，提升医疗服务能力，推动互联网+医疗健康便民惠民服务向纵深拓展。

1.AI平台建设：建设人工智能平台，包含模型训练推理、模型应用、AI辅助运营分析三个功能模块，全市集中部署，为医疗服务的智能化升级提供支撑。

2.VTE系统AI语义识别：VTE深静脉血栓防治系统需内嵌AI语义VTE变量数据采集工具，自动识别抓取医院住院患者的既往史、现病史、查体、病程、医嘱与检查化验等数据，用于VTE各类风险评估量表、出血风险量表与诊断评估。

3.VTE系统知识图谱应用：VTE系统需运用知识图谱语义技术，针对所需识别抓取的数据进行不局限于关键词的具有语义技术的上下文关联理解判断，实现自动评估。

4.VTE量表AI自动评估：支持AI语义VTE量表的自动评估与自动评分功能，自动统计所有VTE风险因素的评分与风险等级，针对评估结果为中高风险的患者自动评估出血风险、wells诊断评估与机械预防禁忌评估。

5.VTE评估结果溯源：AI自动评估后自动输出评估结果，展示自动评估出的每一项评估依据的溯源信息，具体评估依据用红色字突出显示，且显示的溯源内容拥有相关联的上下文。

6.VTE评估对比分析工具：支持对Caprini、Padua、产科表、Khorana、内科出血风险评估表、外科出血风险评估表、Wells-DVT、Wells-PE等9张VTE量表的AI自动评估与人工评估结果进行差异度查看，并能对差异化程度进行逐项对比分析，快速定位差异化数据并对其进行快速校准。

7.VTE预防措施智能推荐：根据VTE风险评估结果与出血风险结果推荐对应的预防策略与预防措施项目，针对评估结果为中高危时自动发起相应的出血风险评估，并自动发起相关诊断评估量表，智能推荐预防措施的辅助建议与诊断建议。

8.VTE医嘱自动抓取与核查：系统在每一次AI自动评估后至下一个规定的评估之间，自动从EMR或医嘱系统抓取医生开具的预防医嘱数据并展示在机械或药物预防展示区提醒护士医生，支持预防措施的医嘱溯源，支持预防措施的自动核查和合理化判断，对医生开具的预防医嘱进行合理化判断计入质控，对护士操作落实进行跟踪与提醒。",2026-04-07,长春市卫生健康委员会,林叶、王洋,0431-81150785,吉林,长春市,178.00万元,http://www.ccgp.gov.cn/cggg/dfgg/gkzb/202603/t20260317_26281175.htm,吉林省长春市二道区（经济技术开发区）东南湖大路1281号
扬州市生态科技新城新一代电子政务外网项目(2026),2026-03-17T16:12+08:00,无相关要求,无相关要求,无相关要求,2026-04-08,扬州市生态科技新城管理委员会（机关）,陈畅,0514-82087120,,扬州市,165.00万元,http://www.ccgp.gov.cn/cggg/dfgg/gkzb/202603/t20260317_26279127.htm,扬州市新万福路88号
苏州科技城医院智能化系统维保服务,2026-03-17T16:08+08:00,无相关要求,无相关要求,无相关要求,2026-04-08,苏州科技城医院,魏雄平,0512-67228823,江苏,,108.00万元,http://www.ccgp.gov.cn/cggg/dfgg/gkzb/202603/t20260317_26279073.htm,苏州高新区漓江路1号
大同市公安局交通管理支队无人机机巢建设项目,2026-03-17T16:06+08:00,无相关要求,无相关要求,无相关要求,2026-04-08,大同市公安局交通管理支队,乔女士,15296625009,山西,大同市,190.00万元,http://www.ccgp.gov.cn/cggg/dfgg/gkzb/202603/t20260317_26279029.htm,大同市平城区大庆东路382号
云南部分地区宏观观测站水温智能化升级改造（试点）,2026-03-17T15:38+08:00,无相关要求,无相关要求,无相关要求,2026-04-08,云南省地震局,浦艺晴、李俊、胡兴松、陈红、胡琛、张昊然,13759529693、0871-68338999,云南,昆明市,99.60万元,http://www.ccgp.gov.cn/cggg/zygg/gkzb/202603/t20260317_26278633.htm,昆明市盘龙区北辰大道148号
