project_name,pub_time,ai_project_title,requirement_brief,requirement_desc,deadline,company_name,contact_name,contact_phone,province,city,budget,announcement_url,location_text
乡村振兴产教融合育训基地项目乡村数字经济产教融合实训中心-业财融合实践教学平台采购,2026-03-24T14:31+08:00,乡村振兴业财融合AI实践教学平台,构建AI驱动的业财融合实践教学平台，实现自动制单、智能写作、影像识别、知识图谱管理、AIGC智教、智能记账分析和数电发票识别等功能，以培养学生的业财融合意识和商务数据分析能力。,"【背景概述】
乡村振兴产教融合育训基地项目乡村数字经济产教融合实训中心-业财融合实践教学平台采购，包001构建财税生产性实践平台培养学生业财融合意识；包002围绕""大数据+电商+财务""培养学生商务数据分析能力；包003搭建智能化成本核算与管理平台实现企业财税全流程实训。

AI需求点：
1. AI自动制单：在财税生产性实践平台中，AI根据用户输入的经济业务内容智能推荐对应单据类型，根据确认的单据类型和业务信息自动编制原始凭证，编制过程中对信息进行智能解析和格式化，支持凭证一键截图。

2. AI智能写作：在财税生产性实践平台中，支持AI生成论文大纲，根据论文选题、研究目的、适用层级、学科领域、论文类型、参考文件等内容，通过精密算法解析论文选题精髓，AI自动生成个性化论文大纲；左侧显示AI生成的论文大纲，可针对大纲内容进行重命名、新增同级、新增子级和删除，针对某个大纲内容AI生文可生成匹配内容，支持插入表格、图片和参考文献格式设置。

3. 影像识别：在智能化成本核算与管理平台中，影像扫描功能进行影像识别，根据业务票据建模完成的模板进行影像审核并记账。

4. 知识图谱管理：在大数据税务风险防控实战平台中，支持查看课程知识图谱，查看知识点节点与关联关系，支持画布拖拽缩放、节点拖拽等图谱自定义布局操作，支持选中单个节点高亮相关节点、搜索知识点定位并高亮节点，支持通过知识点标签、知识点层级、认知领域六层次、知识四维度进行高级搜索；支持知识图谱个性化设置，可在知识图谱地图与思维导图中切换知识点呈现模式，支持图谱显示规则设置。

5. AIGC智教功能：在智能化成本核算与管理平台配套AIGC智教与思政模块中，提供线上智教云平台，涵盖智能问答、课程设计、教学大纲、教案设计、智能出题、PPT生成、财务分析等模块。

6. 智能记账分析：在线上共享记账平台中，智能日记账功能支持录入一段文字智能分析出交易日期、交易金额、收支科目、对方单位、部门、经办人，并根据部门分析收支科目为销售费用、管理费用等。

7. 数电发票识别：在财会职业能力养成平台软件配套单机版中，包含数电发票识别游戏，演示财务机器人发票识别流程。",2026-04-15,辽宁农业职业技术学院,潘婷婷、张冬妮、齐俭、石增良、刘甲峰,024-31918388-330,辽宁,,143.00万元,http://www.ccgp.gov.cn/cggg/dfgg/gkzb/202603/t20260324_26306805.htm,营口经济技术开发区熊岳镇育才里76-0号
光学工程学科交叉泛家居空间主动健康综合研发平台(二次),2026-03-24T18:04+08:00,无相关要求,无相关要求,无相关要求,2026-04-15,佛山大学,涂倩、吴福美、许小佳,0757-82724379,广东,佛山市,660.00万元,http://www.ccgp.gov.cn/cggg/dfgg/gkzb/202603/t20260324_26309661.htm,广东省佛山市南海区狮山镇广云路33号
信阳市城市水务中心信阳市中心城区水环境智慧管理平台运行维护项目,2026-03-24T17:25+08:00,无相关要求,无相关要求,无相关要求,2026-04-16,信阳市城市水务中心,曹帅锋,15537633291,河南,信阳市,198.24万元,http://www.ccgp.gov.cn/cggg/dfgg/gkzb/202603/t20260324_26309208.htm,信阳市羊山新区新十二街
河北科技大学五大研究院实验装具采购,2026-03-24T15:04+08:00,无相关要求,无相关要求,无相关要求,2026-04-16,河北科技大学,郭盼,0311-86982566,河北,石家庄市,210.00万元,http://www.ccgp.gov.cn/cggg/dfgg/gkzb/202603/t20260324_26307104.htm,石家庄市裕翔街26号
骨科关节手术机器人,2026-03-24T14:54+08:00,无相关要求,无相关要求,无相关要求,2026-04-14,上海交通大学医学院附属仁济医院,刘韵,13918978427,上海,中国上海市,170.00万元,http://www.ccgp.gov.cn/cggg/dfgg/gkzb/202603/t20260324_26307001.htm,中国上海市东方路1630号
黄山学院智能机器人实验室设备采购项目,2026-03-24T12:15+08:00,无相关要求,无相关要求,无相关要求,2026-04-16,黄山学院,俞工,0559-2321558,安徽,黄山市,160.00万元,http://www.ccgp.gov.cn/cggg/dfgg/gkzb/202603/t20260324_26306368.htm,安徽省黄山市屯溪区西海路39号
中国民用航空局清算中心呼叫中心系统建设采购项目,2026-03-24T17:32+08:00,无相关要求,无相关要求,无相关要求,2026-04-15,中国民用航空局清算中心,晨歌,01084384717,北京,北京市,136.75万元,http://www.ccgp.gov.cn/cggg/zygg/gkzb/202603/t20260324_26309237.htm,北京市朝阳区汇泉一街9号院1号楼
信息化建设,2026-03-24T14:44+08:00,无相关要求,无相关要求,无相关要求,2026-04-16,迁安市中医医院,李淑云,0315-8034395,河北,迁安市,390.00万元,http://www.ccgp.gov.cn/cggg/dfgg/gkzb/202603/t20260324_26306915.htm,河北省迁安市佛山路66号
巫山中学智慧校园建设项目,2026-03-24T16:55+08:00,无相关要求,无相关要求,无相关要求,2026-04-13,重庆市巫山中学,姜平,13594722058,重庆,重庆市,398.00万元,http://www.ccgp.gov.cn/cggg/dfgg/gkzb/202603/t20260324_26308703.htm,重庆市巫山县巫峡路448号
平顶山市应急救援保障中心考试点安全生产考试设备更新项目（配套部分）项目,2026-03-24T16:49+08:00,无相关要求,无相关要求,无相关要求,2026-04-14,平顶山市应急救援保障中心,王女士,0375-3828737,河南,平顶山市,157.20万元,http://www.ccgp.gov.cn/cggg/dfgg/gkzb/202603/t20260324_26308627.htm,河南省平顶山市湛河区姚孟村北。
滨海幸福生活馆智能化建设,2026-03-24T16:41+08:00,无相关要求,无相关要求,无相关要求,2026-04-22,福建医科大学附属第一医院,蔡闽珠、高花玲、郑少鸿,0591-83896688,福建,福州市,89.97万元,http://www.ccgp.gov.cn/cggg/dfgg/gkzb/202603/t20260324_26308394.htm,福州市台江区茶中路20号
急救实训中心设备采购项目,2026-03-24T16:01+08:00,无相关要求,无相关要求,无相关要求,2026-04-14,东莞职业技术学院,卢瑞玲,0769-28330643,广东,东莞市,107.00万元,http://www.ccgp.gov.cn/cggg/dfgg/gkzb/202603/t20260324_26307790.htm,东莞市松山湖大学路3号东莞职业技术学院行政楼
上海市长宁区天山中医医院部分检验试剂服务及采购项目,2026-03-24T15:12+08:00,无相关要求,无相关要求,无相关要求,2026-04-14,上海市长宁区天山中医医院,陆汉雯、郑颖,13774477656、62103825-8017,上海,,112.00万元,http://www.ccgp.gov.cn/cggg/dfgg/gkzb/202603/t20260324_26307182.htm,娄山关路868号
金华市汤溪高级中学城区校区新建项目（智能化项目）,2026-03-24T09:39+08:00,无相关要求,无相关要求,无相关要求,2026-04-14,金华市汤溪高级中学,徐雪丹,0579-83171503,浙江,金华市,160.00万元,http://www.ccgp.gov.cn/cggg/dfgg/gkzb/202603/t20260324_26305472.htm,金华市汤溪镇东湖街118号
大碶派出所迁建工程-办案区智能化项目,2026-03-24T09:19+08:00,无相关要求,无相关要求,无相关要求,2026-04-13,宁波市公安局北仑区分局,刘工,13362851624,浙江,,51.99万元,http://www.ccgp.gov.cn/cggg/dfgg/gkzb/202603/t20260324_26305369.htm,北仑区庐山西路18号
浮山县档案馆库房搬迁与智慧化升级改造项目,2026-03-24T18:40+08:00,无相关要求,无相关要求,无相关要求,2026-04-14,浮山县档案馆,贾先生,0357-2220333,山西,临汾市,65.80万元,http://www.ccgp.gov.cn/cggg/dfgg/gkzb/202603/t20260324_26309852.htm,山西省临汾市浮山县新风街70号
延吉市安全能力提升智慧服务项目,2026-03-24T18:14+08:00,无相关要求,无相关要求,无相关要求,2026-04-15,延吉市住房和城乡建设局,蔡莹莹,0433-2663210,吉林,延吉市,234.00万元,http://www.ccgp.gov.cn/cggg/dfgg/gkzb/202603/t20260324_26309735.htm,延吉市建工街明河胡同407号
饶平县公安局智能打私海防监控补点（海山、柘林）项目,2026-03-24T17:44+08:00,无相关要求,无相关要求,无相关要求,2026-04-14,饶平县公安局,马工,13546867755,广东,,102.45万元,http://www.ccgp.gov.cn/cggg/dfgg/gkzb/202603/t20260324_26309460.htm,饶平县黄冈镇汕汾公路龙城路段15号
智能病历质控信息系统应用软件采购项目(二次),2026-03-24T17:36+08:00,无相关要求,无相关要求,无相关要求,2026-04-15,金堂县第一人民医院,丁春来、黄瑶、王师沁,18583959483,四川,成都市,120.00万元,http://www.ccgp.gov.cn/cggg/dfgg/gkzb/202603/t20260324_26309352.htm,成都市金堂县赵镇金广路886号
法庭维修改造配套信息化设备采购,2026-03-24T17:30+08:00,多语种语音识别与庭审信息化系统,采购支持多语种及方言的语音转写软件，实现实时语音识别、录音文件转写等功能，并与智慧庭审软件系统无缝对接。书记员模块需实时识别不同语音流并区分显示，支持语音识别功能随时开启/关闭。电子签字捺印终端需集成公安部标准指纹仪，支持高精度比对。,"1、语音转写软件需支持中文、英文、日语、韩语、藏语、维语、哈萨克语、四川方言、贵州方言、台湾口音、闽南语、粤语等语种及方言的语音识别能力，支持实时语音识别、录音文件转写、语音检出（VAD）、语音增强降噪、逆文本标准化、自动智能标点、识别热词管理，与智慧庭审软件系统无缝对接，自动根据语音识别内容生成庭审笔录。

2、庭审应用系统书记员模块需将庭审中各方发言人所说的多条不同语音流实时识别为对应文字内容，按角色区分显示在书记员电脑应用客户端左侧边栏，支持语音识别功能随时开启/关闭，开启自动转写后可将识别文字自动插入庭审笔录。

3、电子签字捺印终端需集成公安部标准指纹仪，支持1:1和1:N比对方式，认假率（FAR）<0.001%，拒真率（FRR）<1%。",2026-04-14,辽宁省丹东市中级人民法院,范女士,0415-3113001,辽宁,丹东市,99.40万元,http://www.ccgp.gov.cn/cggg/dfgg/gkzb/202603/t20260324_26309285.htm,丹东市振兴区滨江中路30号
JC-2026002Z大理州妇幼保健院“大理普惠托育服务”智慧托育信息平台监管指挥中心设备公开招标采购项目,2026-03-24T17:21+08:00,无相关要求,无相关要求,无相关要求,2026-04-16,大理白族自治州妇幼保健院,申老师,0872-2368190,云南,,63.40万元,http://www.ccgp.gov.cn/cggg/dfgg/gkzb/202603/t20260324_26309165.htm,大理白族自治州下关盛林路5号
宜春市安全生产考试中心直属考试点改造升级项目,2026-03-24T17:15+08:00,无相关要求,无相关要求,无相关要求,2026-04-02,宜春市应急管理局,陈女士,15932804014,江西,宜春市,0.01万元,http://www.ccgp.gov.cn/cggg/dfgg/gkzb/202603/t20260324_26309066.htm,宜春市宜阳大厦西座12楼
嘉兴市卫生健康委员会国家传染病智能监测预警前置软件服务项目,2026-03-24T16:52+08:00,无相关要求,无相关要求,无相关要求,2026-04-14,嘉兴市卫生健康委员会,苑洪春、李博,0571-81061814，0571-81061817,浙江,嘉兴市,264.00万元,http://www.ccgp.gov.cn/cggg/dfgg/gkzb/202603/t20260324_26308659.htm,嘉兴市文桥路486号
宁海县教育局“智体惠民”智慧体育创建项目,2026-03-24T16:50+08:00,无相关要求,无相关要求,无相关要求,2026-04-16,宁海县教育服务与装备管理中心,薛丹明,0574-65507133,浙江,,118.12万元,http://www.ccgp.gov.cn/cggg/dfgg/gkzb/202603/t20260324_26308636.htm,宁海县人民路290号
浙江省2025年全国农作物病虫疫情监测分中心（省级）田间监测点项目昆虫性诱智能监测系统等,2026-03-24T16:36+08:00,无相关要求,无相关要求,无相关要求,2026-04-14,浙江省植保检疫与农药管理总站,徐均,0571-85830191,浙江,杭州市,133.00万元,http://www.ccgp.gov.cn/cggg/dfgg/gkzb/202603/t20260324_26308350.htm,浙江省杭州市江干区凤起东路29号
文山州广播电视与视听新媒体监测监管系统升级改造建设项目,2026-03-24T15:46+08:00,无相关要求,无相关要求,无相关要求,2026-04-14,文山州广播电视局,张应美,15126764520,云南,文山市,277.10万元,http://www.ccgp.gov.cn/cggg/dfgg/gkzb/202603/t20260324_26307600.htm,文山市永康路2号
西南交通大学东部（国际）校区AI视觉中枢预警平台采购项目,2026-03-24T15:27+08:00,校园AI视觉中枢预警平台建设,西南交通大学东部（国际）校区通过引入AI视觉分析技术，建立校园AI数据库，实现异常自动识别、实时预警和精准处置，提升校园安全管理智能化水平。,"【背景概述】
西南交通大学东部（国际）校区AI视觉中枢预警平台项目旨在搭建后端智能分析系统，引入AI视觉分析技术实现异常情况自动识别、实时预警与精准处置，并利用人脸识别、车辆识别、大模型等技术建立校园AI数据库，构建数据驱动、智能预警、协同联动的校园安全治理新模式，实现安防智慧化管理。

1、引入AI视觉分析技术，实现异常情况自动识别、实时预警、精准处置，提升校园安全管理精细化、智能化、高效化水平，构建数据驱动、智能预警、协同联动、全程可控的校园安全治理新模式。

2、充分利用人脸识别、车辆识别、大模型、嵌入式计算等先进技术，建立校园AI数据库，广泛覆盖校园内各种人员、重点场所，实现校园安防智慧化管理功能。",2026-04-14,西南交通大学,童老师,028-84469198-818,四川,成都市,252.00万元,http://www.ccgp.gov.cn/cggg/zygg/gkzb/202603/t20260324_26307283.htm,四川省成都市郫都区犀安路999号
红河州公安局装备设备采购项目,2026-03-24T15:26+08:00,无相关要求,无相关要求,无相关要求,2026-04-20,红河哈尼族彝族自治州公安局,阴翠莲,15287370958,云南,蒙自市,264.55万元,http://www.ccgp.gov.cn/cggg/dfgg/gkzb/202603/t20260324_26307335.htm,蒙自市凤凰路中段25号
新乡学院数字赋能科研服务管理水平提升项目,2026-03-24T14:56+08:00,无相关要求,无相关要求,无相关要求,2026-04-14,新乡学院,刘阳、王现锋、郜彬,15736917378、18638127896,河南,新乡市,99.60万元,http://www.ccgp.gov.cn/cggg/dfgg/gkzb/202603/t20260324_26307015.htm,新乡市金穗大道东段191号
工业和信息化部电子第五研究所人工智能模型测试和管理系统采购项目,2026-03-24T14:31+08:00,无相关要求,无相关要求,无相关要求,2026-04-14,工业和信息化部电子第五研究所,林思韵,020-83336359、020-83516212,广东,广州市,209.00万元,http://www.ccgp.gov.cn/cggg/zygg/gkzb/202603/t20260324_26306757.htm,广州市增城区朱村街朱村大道西78号
北京清华长庚医院—布类品洗缝委外服务项目,2026-03-24T14:07+08:00,无相关要求,无相关要求,无相关要求,2026-04-15,北京清华长庚医院,蒋旭,010-59893109,北京,北京市,273.00万元,http://www.ccgp.gov.cn/cggg/dfgg/gkzb/202603/t20260324_26306689.htm,北京市昌平区立汤路168号
应用型人才培养质量提升项目,2026-03-24T13:50+08:00,无相关要求,无相关要求,无相关要求,2026-04-15,黑龙江工程学院,张淞迪,0451-85975668,黑龙江,哈尔滨市,329.50万元,http://www.ccgp.gov.cn/cggg/dfgg/gkzb/202603/t20260324_26306560.htm,哈尔滨市道外区东直路234号
河北省地质调查院样品测试委托业务费1-3标段,2026-03-24T11:44+08:00,无相关要求,无相关要求,无相关要求,2026-04-15,河北省地质调查院,卢玲菊、杜红叶,0311-83055039,河北,石家庄市,211.33万元,http://www.ccgp.gov.cn/cggg/dfgg/gkzb/202603/t20260324_26306196.htm,石家庄市鹿泉区玉泉路192号
一八四团基本养老服务提升行动示范项目,2026-03-24T20:25+08:00,无相关要求,无相关要求,无相关要求,2026-04-13,新疆生产建设兵团第十师一八四团民生服务中心,高含强,17699710316,,,68.40万元,http://www.ccgp.gov.cn/cggg/dfgg/gkzb/202603/t20260324_26310306.htm,第十师一八四团
石嘴山市中医医院医保监管与智慧服务一体化建设项目,2026-03-24T19:39+08:00,智慧医保监管与服务一体化系统建设,构建DIP系统、医保基金监管系统等，提升医院管理水平、医疗服务质量，实现医疗业务数字化、智能化，提高医保基金使用效率。,"【背景概述】
石嘴山市中医医院医保监管与智慧服务一体化项目建设按照《中医医院信息与数字化建设规范（2024版）》《智慧中医医院试点项目建设指导意见》（国中医药综规财函〔2025〕1号）要求，构建涵盖DIP系统、医保基金监管系统、病案首页质控系统、智慧服务、数字签名系统的医疗信息系统，提升医院管理水平、医疗服务质量和医保基金使用效率，实现医疗业务数字化、智能化和便捷化，让群众少跑腿。

1. DIP分组预测功能：根据在院病例诊疗信息预测分组结果，对当地政策信息数据化，生成医院病组参考值并进行模拟分配。包含DIP分组预测、分组器自动分组、DIP实时动态自动分组、大数据相似分组推荐功能。

2. 智能分组推荐功能：提供大数据相似分组推荐，主动推荐符合医保付费要求的更优质预测病组，便于临床模拟DIP结算，提前判断DIP预计可支付费用。针对无法入组病例提供未入组原因提醒，并与医嘱及其他病历自动比对遗漏手术诊断给予提醒。

3. 风险病例预警功能：提供实时风险监测预警，包括费用异常、不合理入院、超长住院等。

4. 在院病人监控查询功能：实时监控在院病人情况，展示患者病例诊断信息、预测按DIP结算差额。支持查看病例详情，可按疑点规则进行筛选，疑点规则包括低标入院、是否入组、费用提醒等。

5. 医保结算清单AI质控功能：事前对医生结算清单实时审核质控，根据结算清单质控规则库及其逻辑，对提交过来的数据进行AI运算，提示违反结算清单质控规则的数据，返回违规详情并提出建议。

6. 费用占比异常病例监控功能：筛选出某类费用占比异常的病例，如耗占比、药占比超高病例，以便筛选出疑似存在不合理诊疗、过度医疗等行为。",2026-04-14,石嘴山市中医医院,孟令韦、赵星星,0952-4011188,宁夏,石嘴山市,170.00万元,http://www.ccgp.gov.cn/cggg/dfgg/gkzb/202603/t20260324_26310165.htm,石嘴山市大武口区长庆东街206号
昆山开发区智慧消防服务中心,2026-03-24T18:40+08:00,无相关要求,无相关要求,无相关要求,2026-04-14,江苏昆山经济技术开发区管理委员会,徐扬,0512-57782158,江苏,昆山市,421.00万元,http://www.ccgp.gov.cn/cggg/dfgg/gkzb/202603/t20260324_26309858.htm,昆山市前进东路369号时代大厦
子弟学校智慧黑板,2026-03-24T18:06+08:00,无相关要求,无相关要求,无相关要求,2026-04-15,西安理工大学,石雨鑫、张丰利、刘菲、王倩倩,15091632950,陕西,西安市,182.52万元,http://www.ccgp.gov.cn/cggg/dfgg/gkzb/202603/t20260324_26309684.htm,西安市金花南路5号
四川大学华西医院多院区智慧后勤一体化管理系统采购项目(第二次）,2026-03-24T18:04+08:00,无相关要求,无相关要求,无相关要求,2026-04-17,四川大学华西医院,王宇、王晓、曾瑛、李紫薇,13111881710、18728432140,四川,,300.00万元,http://www.ccgp.gov.cn/cggg/zygg/gkzb/202603/t20260324_26309593.htm,成都国学巷37号
闵行区绿化市容生活垃圾分类智慧收运系统建设项目,2026-03-24T17:10+08:00,无相关要求,无相关要求,无相关要求,2026-04-13,上海市闵行区绿化和市容管理局,汤丽丽,33882603,上海,,168.00万元,http://www.ccgp.gov.cn/cggg/dfgg/gkzb/202603/t20260324_26308969.htm,疏影路700号
丰城市“接诉即办”智慧治理平台项目,2026-03-24T16:40+08:00,无相关要求,无相关要求,无相关要求,2026-04-02,中共丰城市委社会工作部,刘先生、熊女士、杨先生,0795-6607985,江西,丰城市,0.01万元,http://www.ccgp.gov.cn/cggg/dfgg/gkzb/202603/t20260324_26308389.htm,丰城市政府大楼2楼
宁夏工商职业技术大学2025年度国家“双高计划”应用化工专业群智慧教室建设项目,2026-03-24T16:29+08:00,无相关要求,无相关要求,无相关要求,2026-04-14,宁夏工商职业技术大学,田彬,0951-6891055,宁夏,银川市,150.00万元,http://www.ccgp.gov.cn/cggg/dfgg/gkzb/202603/t20260324_26308188.htm,银川市西夏区大连西路531号
佛山大学生物安全实验平台设备采购（二次）,2026-03-24T16:17+08:00,无相关要求,无相关要求,无相关要求,2026-04-14,佛山大学,李锐昌,0757-83126103,广东,佛山市,378.00万元,http://www.ccgp.gov.cn/cggg/dfgg/gkzb/202603/t20260324_26308022.htm,佛山市南海区狮山镇广云路33号
新能源学院智慧图书馆建设设备采购项目,2026-03-24T15:48+08:00,无相关要求,无相关要求,无相关要求,2026-04-14,内蒙古工业大学,李伟奇；质疑联系人；阮佳（邮寄质疑应邮寄给质疑联系人）,0471-5332614；质疑联系电话：0471-5332613,内蒙古,,626.12万元,http://www.ccgp.gov.cn/cggg/dfgg/gkzb/202603/t20260324_26307624.htm,内蒙古工业大学
智慧监管巡查预警系统建设工程,2026-03-24T15:44+08:00,无相关要求,无相关要求,无相关要求,2026-04-14,邯郸市肥乡区看守所,赵建军,0310-8561001,河北,邯郸市,74.28万元,http://www.ccgp.gov.cn/cggg/dfgg/gkzb/202603/t20260324_26307585.htm,邯郸市肥乡区看守所
智慧药房建设项目采购项目(三次),2026-03-24T15:41+08:00,无相关要求,无相关要求,无相关要求,2026-04-15,内江市中医医院,刘老师,0832-2029224(评审)、2263953（文件）、2022630（开标）,四川,内江市,960.00万元,http://www.ccgp.gov.cn/cggg/dfgg/gkzb/202603/t20260324_26307559.htm,内江市东兴区大千路696号
计量标准器具智慧化升级项目,2026-03-24T15:31+08:00,无相关要求,无相关要求,无相关要求,2026-04-14,沈阳市市场监管事务服务中心（沈阳市检验检测中心）,张晓龙,024-22503077、22503148,辽宁,沈阳市,25.70万元,http://www.ccgp.gov.cn/cggg/dfgg/gkzb/202603/t20260324_26307448.htm,沈阳市和平区南八马路90号
智慧城市更新技术职业技能公共训创中心,2026-03-24T15:07+08:00,无相关要求,无相关要求,无相关要求,2026-04-16,东莞职业技术学院,蔡惠芬,0769-28330672,广东,东莞市,727.80万元,http://www.ccgp.gov.cn/cggg/dfgg/gkzb/202603/t20260324_26307137.htm,东莞市松山湖大学路3号东莞职业技术学院行政楼
河北省张家口市中级人民法院信息化运行维护外包项目,2026-03-24T12:44+08:00,无相关要求,无相关要求,无相关要求,2026-04-15,张家口市中级人民法院本级,张娜,0313-7680613,河北,张家口市,135.00万元,http://www.ccgp.gov.cn/cggg/dfgg/gkzb/202603/t20260324_26306433.htm,张家口市桥东区建国路29号
5G+AI内镜远程诊疗平台、电子十二指肠镜、纤维鼻咽喉镜系统,2026-03-24T17:10+08:00,无相关要求,无相关要求,无相关要求,2026-04-15,重庆市巴南区第二人民医院,袁建文 钟若仪,023-67703281 67120648,重庆,重庆市,283.00万元,http://www.ccgp.gov.cn/cggg/dfgg/gkzb/202603/t20260324_26308980.htm,重庆市巴南区花溪街道花溪新村18号
沈阳师范大学AI赋能师范生外语综合技能实训室设备采购项目,2026-03-24T15:31+08:00,无相关要求,无相关要求,无相关要求,2026-04-14,沈阳师范大学,吴娜、刘佳琦、王磊、邹强,024-31513417,辽宁,沈阳市,120.00万元,http://www.ccgp.gov.cn/cggg/dfgg/gkzb/202603/t20260324_26307442.htm,沈阳市皇姑区黄河北大街253号
灵丘县人民医院新院区建设配套医疗设备项目（第四批）,2026-03-24T16:13+08:00,无相关要求,无相关要求,无相关要求,2026-04-16,灵丘县医疗集团,张蕾、宁静、薛静,0351-3521685,山西,,162.00万元,http://www.ccgp.gov.cn/cggg/dfgg/gkzb/202603/t20260324_26307959.htm,灵丘县武灵镇青年北路96号
人工智能语料集一期开发服务,2026-03-23T17:00+08:00,无相关要求,无相关要求,无相关要求,2026-04-13,复旦大学附属中山医院,陈洁、胡艳辉,18918322133、13308394467,上海,上海市,290.00万元,http://www.ccgp.gov.cn/cggg/zygg/gkzb/202603/t20260323_26300986.htm,上海市徐汇区枫林路180号
互联网大数据服务项目,2026-03-23T17:53+08:00,无相关要求,无相关要求,无相关要求,2026-04-17,渭南市公安局,采购代理机构赵温馨,029-82528801、029-89183511,陕西,渭南市,460.00万元,http://www.ccgp.gov.cn/cggg/dfgg/gkzb/202603/t20260323_26301726.htm,渭南市高新区东兴街11号
